text,true_label,pred_label,pred_proba
what do want for xmas how about free text messages new video phone with half price line rental call free now on to find out more,smishing,smishing,1.0
dont know you bring some food,ham,ham,7.267303e-05
its only ard rest all ard at leastwhich is price bedrm,ham,ham,0.00021087521
oh fine ill be by tonight,ham,ham,0.00024095674
just checking in on you really do miss seeing jeremiah do have great month,ham,ham,5.258153e-06
lol ok ill snatch her purse too,ham,ham,0.0023258498
you have an important customer service announcement calnumber now,smishing,smishing,1.0
which is why never wanted to tell you any of this which is why im so short with you and onedge as of late,ham,ham,7.7757206e-05
im on the bus love you,ham,ham,0.0002086152
me babe feel the same lets just get about itboth try cheer upnot fit soo muchxxlove locaxx,ham,ham,5.5218497e-05
nothing splwat abt and whr ru,ham,ham,5.6300603e-05
yeah probably but not sure ilol let know but personally wuldnt bother then again if ur goin to then mite as well,ham,ham,0.00062517327
shall bring us bottle of wine to keep us amused only joking ill bring one anyway,ham,smishing,1.0
was just callin to say hi take care bruv,ham,ham,0.0043420023
free for st week no nokia tone ur mob every week just txt nokia to zed pobox wwq normptone,spam,smishing,1.0
no need to ke qi too bored izzit suddenly thk of this,ham,ham,0.0023064392
was gr to see that message so when leaving congrats dear what school and wat ur plans,ham,ham,0.0003204375
oktell me later,ham,ham,0.00032309408
smile in pleasure smile in pain smile when trouble pours like rain smile when sum hurts smile becoz someone still loves to see smiling keep smiling,ham,ham,0.0030933924
navratra special launching th oct chd presnts phase of avenue shona road gurgaon rs lease rs as inaugural discount sms icd to,spam,smishing,0.7385503
aah bless hows your arm,ham,ham,0.001479391
yay cant wait to party together,ham,ham,0.0026471661
you want to go,ham,ham,6.201879e-05
link to your picture has been sent you can also use httpaltocoukwavewaveaspo,smishing,ham,0.0019796877
wonder if youll get this text,ham,ham,0.0001611833
partys at my place at usf no charge but if you can contribute in any way it is greatly appreciated and yeah we got room for one more,ham,ham,0.00035863044
minimum walk is miles day,ham,ham,0.00012556576
just now saw your messageit da,ham,ham,0.00010471659
pls give her the food preferably pap very slowly with loads of sugar you can take up to an hour to give it and then some water very very slowly,ham,ham,0.013247033
hiya comin bristol st week in april les got off rudi on new yrs eve but was snoringthey were drunk bak at college yet my work sends ink bath,ham,ham,0.076310456
monthly password for wap mobsicom is use your wap phone not pc,spam,smishing,1.0
kkwhat are detail you want to transferacc no enough,ham,ham,0.01727732
want to send me virtual hug need one,ham,ham,0.00016354842
free minutes to any mobile free text free camcorder reply or call,smishing,smishing,1.0
thanx sending me home,ham,ham,0.00019274285
she said do mind if go into the bedroom for minute ok sed in sexy mood she came out minuts latr wid caken my wifechildren were there with her,ham,ham,0.00039743487
me fineabsolutly fine,ham,ham,5.0754665e-05
you have new message please call,smishing,ham,0.0128894225
saw guys and dolls last night with patrick swayze it was great,ham,ham,2.755957e-05
yesgauti and sehwag out of odi series,ham,ham,0.00054649625
well balls time to make calls,ham,ham,0.0005022879
reverse is cheating that is not mathematics,ham,ham,6.1359104e-05
dear paytm customer your paytm kyc has expired contact customer care no immediately your account will block within hr thank you paytm team,smishing,smishing,1.0
good friends care for each other close friends understand each other and true friends stay forever beyond words beyond time gud ni,ham,ham,0.0015766331
ree entry in weekly comp for chance to win an ipod txt pod to to get entry std txt rate tcs apply for details,spam,smishing,1.0
enjoy ur life good night,ham,ham,0.0007755632
mind blastin no more tsunamis will occur from now on rajnikant stopped swimming in indian oceand,ham,ham,0.04153196
have had two more letters from will copy them for you cos one has message for you speak soon,ham,ham,0.02761806
fancy shag dointerested sextextukcom txt xxuk suzy to txts cost per msg tncs on website,spam,smishing,1.0
sorry for the delay yes masters,ham,ham,0.0011982026
which channel,ham,ham,0.0022030072
did you call me just now ah,ham,ham,0.10465471
well then you have great weekend,ham,ham,0.00018029581
you have won cash or prize to claim call tc rstm sw ss ppm,smishing,smishing,1.0
it just seems like weird timing that the night that all you and want is for me to come smoke is the same day as when shitstorm is attributed to me always coming over and making everyone smoke,ham,ham,0.00020570433
yo you around friend of mines lookin to pick up later tonight,ham,ham,0.014730675
we walked from my moms right on stagwood pass right on winterstone left on victors hill address is ltgt,ham,smishing,1.0
beautiful truth against gravity read carefully our heart feels light when someone is in it but it feels very heavy when someone leaves it,ham,ham,0.00072685594
my friend just got here and says hes upping his order by few grams hes got ltgt when can you get here,ham,ham,0.28662336
yes its possible but dint try pls dont tell to any one,ham,ham,0.0016262911
do you want new nokia colour phone deliveredtomorrow with free minutes to any mobile free texts free camcorder reply or call,smishing,smishing,1.0
you also didnt get na hi hi hi hi hi,ham,ham,0.001161385
hai ana tomarrow am coming on morning ltdecimalgt ill be there in sathy then we ll go to rto office reply me after came to home,ham,ham,0.03844768
the lay man just to let you know you are missed and thought off do have great day and if you can send me bimbo and ugos numbers ill appreciate safe,ham,ham,0.0035816978
thanks love but am doing torch or bold,ham,ham,0.0015406604
dear we got ltgt dollars hi hi,ham,ham,0.00079544366
stop the story ive told him ive returned it and hes saying should not re order it,ham,ham,0.0022771128
smith waste dai wanna gayle,ham,smishing,0.99026954
eastenders tv quiz what flower does dot compare herself to violet tulip lily txt or to now chance win cash wkentp,spam,smishing,1.0
had your mobile months or more entitled to update to the latest colour mobiles with camera for free call the mobile update co free on,smishing,smishing,1.0
ok then,ham,ham,0.0011372931
private your account statement for shows unredeemed bonus points to claim call identifier code expires,smishing,smishing,1.0
sfine anytime all the best with it,ham,ham,0.00048675257
no meant the calculation is the same that ltgt units at ltgt this school is really expensive have you started practicing your accent because its important and have you decided if you are doing years of dental school or if youll just do the nmde exam,ham,ham,0.0022132802
you available now im like right around hillsborough amp ltgt th,ham,ham,0.00037458062
you are being ripped off get your mobile content from wwwclubmobycom call polytruepixringtonesgames six downloads for only,smishing,smishing,1.0
what is the plural of the noun research,ham,ham,4.4689725e-05
convey my regards to himbest wishes,ham,ham,0.00029873755
asked mobile if chatlines inclu in free mins india cust servs sed yes ler got mega bill dont giv shit bailiff due in days want,spam,smishing,1.0
urgent we are trying to contact todays draw shows that you have won prize guaranteed call from land line claim validhrs only,smishing,smishing,1.0
wat doing,ham,ham,0.0016343879
unless its situation where you go gurl would be more appropriate,ham,ham,2.8119282e-05
do have nice day today love you so dearly,ham,ham,0.00013021869
maybe you should find something else to do instead,ham,ham,0.0011543103
argh my is spotty anyway the only thing remember from the research we did was that province and sterling were the only problemfree places we looked at,ham,ham,0.00088336517
arngd marriage is while walkin unfortuntly snake bites bt love marriage is dancing in frnt of snake amp sayin bite me bite me,ham,ham,0.0046764105
the message sent is askin for ltgt dollars shoul pay ltgt or ltgt,ham,ham,9.3361095e-06
waiting in car my mum lor leh reach home already,ham,ham,0.0005991232
still in the area of the restaurant ill try to come back soon,ham,ham,0.0023838184
and dont plan on staying the night but prolly wont be back til late,ham,ham,0.0008669866
now get rid offcockroachtermitebedbugratsany pestbest deals inpestcontrolserviceschemicalherbalodorlessdialnask,spam,smishing,0.99999475
as entered my cabin my pa said happy bday boss felt special she askd me lunch,ham,ham,0.0008245579
was the farm open,ham,ham,8.506967e-05
alert your rbc royal bank has been suspended to unlock your account click here httpreacmobimobile,smishing,ham,0.08895089
think da you wil do,ham,ham,0.00010388215
oh the grand is having bit of party but it doesnt mention any cover charge so its probably first come first served,ham,ham,0.000412732
sorry man my accounts dry or would if you want we could trade back half or could buy some shit with my credit card,ham,ham,0.3816007
yes but dont care need you bad princess,ham,ham,0.00018094698
yo chad which gymnastics class do you wanna take the site says christians class is full,ham,ham,0.006071753
did get that message,ham,ham,9.75375e-05
donno if they are scorable,ham,ham,6.502829e-05
good afternoon loverboy how goes you day any luck come your way think of you sweetie and send my love across the sea to make you smile and happy,ham,ham,7.710617e-05
mm am on the way to railway,ham,ham,0.0016054766
eerie nokia tones rply tone title to eg tone dracula to titles ghost addamsfa munsters exorcist twilight wwwgetzedcouk poboxwwq,spam,smishing,1.0
okcongrats,ham,ham,0.018500324
lol boo was hoping for laugh,ham,ham,0.00014993873
these wont do have to move on to morphine,ham,ham,0.01535402
sorry ill call laterhv some work,ham,ham,0.016725378
how much for an eighth,ham,ham,0.0005769757
luv soo much dont understand how special me ring morrow luv xxx,ham,ham,0.0006342859
private your account statement for shows unredeemed sim points call identifier code expires,smishing,smishing,1.0
lolnice went from fish to water,ham,smishing,1.0
should make fb list,ham,ham,0.00028408616
but im really really broke oh no amount is too small even ltgt,ham,ham,0.0032148748
ok help me ask if shes working tmr not,ham,ham,0.0007222982
crucify is not you should have told me earlier,ham,ham,0.0006354701
dear customer your order of euro has been approved if you didnt purchased anything or it you believe an unauthorized person has accessed your account please access the link below httpordersaspx,smishing,smishing,0.9991345
might come by tonight then if my class lets out early,ham,ham,0.00018737922
this weeks savamob member offers are now accessible just call for details savamob pobox la wu only week savamob offers mobile,smishing,smishing,1.0
you have won guaranteed cash or prize to claim yr prize call our customer service representative on between ampm,smishing,smishing,1.0
log off wat its sdrybi,ham,ham,0.0006700267
but have to like to have love and arrange,ham,ham,0.0026008177
records indicate you were involved in an accident in the last years as such you are entitled to claim compensation reply claim for info or stop to opt out,smishing,smishing,1.0
haha dont be angry with yourself take it as practice for the real thing,ham,ham,0.00023192113
this is ur face test ltgt select any number will tell ur face astrology am waiting quick reply,ham,ham,0.12500878
double mins and txts months free bluetooth on orange available on sony nokia motorola phones call mobileupd on,spam,smishing,1.0
ya ok vikky vl witin ltgt mins and il reply,ham,ham,0.00020584483
jus reached home go bathe first but my sis using net tell when she finishes,ham,ham,9.9786346e-05
wat happened to the cruise thing,ham,ham,0.0011743892
we have all rounderso not required,ham,ham,1.5539066e-05
freemsgfeelin kinda lnly hope like keep me company jst got cam moby wanna my pictxt or reply date to msgp rcv hlp stop to,spam,smishing,0.9999999
youve won tkts to the euro cup final or cash to collect call pobox ppm,smishing,smishing,1.0
will come to ur home now,ham,ham,0.0010997682
dont know supports ass and srt thnk think ps can play through usb too,ham,smishing,0.9999989
you please give us connection today itself before ltdecimalgt or refund the bill,ham,ham,0.43579194
free polyphonic ringtone text super to to get your free poly tone of the week now sn pobox nr zs subscription pw,spam,smishing,1.0
meet top us universities in delhi at india habitat centre lodhi road on nov th to pm for student admissionentry free details contact,spam,smishing,1.0
evening good if somewhat event laden will fill you in dont you worry head ok but throat wrecked see you at six then,ham,ham,7.174168e-05
hanging out with my brother and his family,ham,ham,9.6490105e-05
freemsg hey im buffy and love to satisfy men home alone feeling randy reply my pix qlynnbv helpp msg send stop to stop txts,spam,smishing,0.83906496
what he said is not the matter my mind saying some other matter is there,ham,ham,0.0006736931
lol no ouch but wish id stayed out bit longer,ham,ham,3.2333337e-05
yo any way we could pick something up tonight,ham,ham,0.00065719127
if bored up just come to my home,ham,ham,0.00053627207
hmm ill have to think about it ok youre forgiven,ham,ham,0.00025090005
did you try making another butt,ham,ham,0.0005158013
oh rite well im with my best mate pete who went out with week now were geva again its been longer than week,ham,ham,0.009869236
good sleep is about rhythm the person has to establish rhythm that the body will learn and use if you want to know more,ham,ham,0.45424628
hi do want to join me with sts later meeting them at five call after class,ham,ham,0.05050666
also remember the beads dont come off ever,ham,ham,1.9777424e-05
aight do you still want to get money,ham,ham,0.0015394512
only for girls bbambaexecutive mbabscitbio techbtech flexible timings govtrecognizedwwwbsaitmin join bsaitm vikaspuri,spam,smishing,1.0
how are you with moneyas in to youmoney aint thinghow are you sha,ham,ham,0.028012596
really dun bluff me leh sleep early too nite,ham,ham,0.00034802384
urgent ireland gov has issued payment of to all residents as part of its promise to battle covid tap here to apply httpurliej,smishing,smishing,0.9997577
hi baby im sat on the bloody bus at the mo and wont be home until about wanna do somethin later call me later ortxt back jess xx,ham,ham,0.17754939
din tell jus now,ham,ham,0.0005741874
urgent this is our nd attempt to contact your prize from yesterday is still awaiting collection to claim call now aclpm,smishing,smishing,1.0
happy birthday may find ur prince charming soon and stay happy,ham,ham,0.00012981304
last chance claim ur worth of discount vouchers today text shop to now savamob offers mobile cs savamob pobox muz,smishing,smishing,1.0
as usualiam fine happy amp doing well what about,ham,ham,0.0016530731
kkim also finewhen will you complete the course,ham,ham,0.0001647051
wil be there with in ltgt minutes got any space,ham,ham,0.0005372748
final chance claim ur worth of discount vouchers today text yes to now savamob member offers mobile cs savamob pobox muz subs,smishing,smishing,1.0
anyway dont think can secure anything up here lemme know if you want me to drive down south and chill,ham,ham,0.00011310768
hey is rite put evey mnth is that all,ham,ham,1.5288882e-05
are you ok what happen to behave like this,ham,ham,0.00096455496
do you want new nokia colour phone delivered tomorrow with free minutes to any mobile and free camcorder reply or call,smishing,smishing,1.0
go and sleep well take rest,ham,ham,0.00022614072
gsoh good with the ladiesu could male gigolo join the uks fastest growing mens club reply oncall mjzgroup stop reply stop msgrcvd,spam,ham,0.30820593
dont you have message offer,ham,ham,0.00018648288
housemaid is the murderer coz the man was murdered on th january,ham,ham,0.0024375187
let me know how to contact you ive you settled in room lets know you are ok,ham,ham,3.639511e-05
borrow ur bag ok,ham,ham,0.00010290774
dear umma she called me now,ham,ham,0.00010680381
where are you call me,ham,ham,0.00017961906
should have picked up receipt or something earlier,ham,ham,0.0040429034
in da car park,ham,ham,0.00014544092
aight ill get it later,ham,ham,0.00020936063
wats da model num of ur phone,ham,ham,0.0009456506
you give us back my id proof and ltgt rs we wont allow you to work we will come to your home within days,ham,ham,0.11705054
thanks for yesterday sir you have been wonderful hope you enjoyed the burial mojibiola,ham,ham,3.9725666e-05
eatin later but im eatin wif my frens now lei going home first,ham,ham,0.00048689265
sorry ill call laterurgent work,ham,ham,0.14608549
have great trip to india and bring the light to everyone not just with the project but with everyone that is lucky to see you smile bye abiola,ham,ham,0.02362615
definitely need module from humanities dis sem izzit wan take other modules st,ham,ham,0.38768217
sms auction brand new nokia is up auction today auction is free join take part txt nokia to now,spam,smishing,0.9999987
the search happiness is of main sources of unhappiness accept life the way it comes will find happiness in every moment live,ham,smishing,0.9888588
understand his loss is my gain so do you work school,ham,ham,1.5838303e-05
am in bus on the way to calicut,ham,ham,0.001447007
th of july,ham,ham,0.00031919143
what you need you have person to give na,ham,ham,0.00752628
havent heard anything and hes not answering my texts so im guessing he flaked that said the jb is fantastic,ham,ham,4.0362393e-05
havent shopping now lor juz arrive only,ham,ham,0.007593584
will you come online today night,ham,ham,0.0001166801
not thought bout it drink in tap spile at seven is that pub on gas st off broad st by canal ok,ham,ham,0.0020400854
wan haf lunch im in da canteen now,ham,ham,0.00012345954
have good evening ttyl,ham,ham,0.000326381
dont know and dont know me send chat to now and lets find each other only pmsg rcvd,spam,smishing,0.57603544
dear customer your pyatm wallet has been booked and hold your amount please complete your kyc contact customer care,smishing,smishing,1.0
one day crab was running on the sea shorethe waves came cleared the footprints of the crab crab asked being my frnd clearing my beautiful footprints waves replied fox was following ur footprints to catch you thats cleared it off frndsship never lets dwn gud nyt,ham,smishing,0.9952722
no shes currently in scotland for that,ham,ham,0.00074948755
the affidavit says ltgt twiggs st division courtroom ltgt lttimegt am ill double check and text you again tomorrow,ham,ham,0.0004460778
your free gift is waiting to be collected simply call,smishing,ham,0.005086423
babe need your advice,ham,ham,0.00024504776
don knowwait will check it,ham,smishing,0.99999964
have secret admirer reveal who thinks so special call to opt out reply reveal stop per msg recd cust care,smishing,smishing,1.0
mmm thats better now got roast down me id better if had few drinks down me good indian,ham,ham,0.00012920728
you might want to pull out more just in case and just plan on not spending it if you can dont have much confidence in derek and taylors money management,ham,ham,0.00019048214
thought we were doing king of the hill thing there,ham,ham,0.00091981527
miss call miss call khelate kintu opponenter miss call dhorte lage thats rule one with great phone receiving quality wins,ham,smishing,0.99972266
excellent spent ltgt years in the air force iraq and afghanistan am stable and honest do you like traveling,ham,ham,4.5813726e-05
im very happy for you babe woo hoo party on dude,ham,ham,0.43850136
say this slowly godi love you need you,ham,ham,2.903068e-05
haha where got so fast lose weight thk muz go month den got effect geelater we go aust put bk weight,ham,ham,0.06852895
make that sake,ham,ham,0.00023918142
wen did you get so spiritual and deep thats great,ham,ham,2.2012902e-05
jade its paul didnt txt me do remember me from barmed want talk txt me,ham,ham,0.032268826
ur hmv quiz cashbalance is currently to maximize ur cashin now send hmv to only pmsg,spam,smishing,1.0
yup havent been there before you want to go for the yoga can call up to book,ham,ham,0.39927667
now im going for lunch,ham,ham,0.0004700959
hi babe its me thanks for coming even though it didnt go that welli just wanted my bed hope to see you soon love and kisses xxx,ham,ham,4.455517e-05
thanks for your subscription to ringtone uk your mobile will be charged month please confirm by replying yes or no if you reply no you will not be charged,spam,smishing,1.0
thanks for being there for me just to talk to on saturday you are very dear to me cherish having you as brother and role model,ham,ham,0.00022895592
hope you are feeling great pls fill me in abiola,ham,ham,4.9089005e-05
well know will take care of me so no worries,ham,ham,0.0002807324
huh also cannot then only how many mistakes,ham,ham,0.0009930062
phony award todays voda numbers ending xxxx are selected to receive award if you have match please call quoting claim code standard rates app,smishing,smishing,1.0
take it we didnt have the phone callon friday can we assume we wont have it this year now,ham,ham,0.0013688887
we regret to inform you that your nab card is now locked to unlock please update security details at httpwwwnabmobile,smishing,ham,0.49925587
hi where you you in home or calicut,ham,ham,0.000110776906
gd lor go shopping got stuff to do wan watch infernal affairs not come lar,ham,ham,0.00017200479
claim shopping spree just call now have you won mobstorequizppm,smishing,smishing,1.0
you made my day do have great day too,ham,ham,0.0010088038
dear customer your pyatm wallet has been booked and hold your amount please complete your kyc contact customer care,smishing,smishing,1.0
oi ami parchi na re kicchu kaaj korte iccha korche na phone ta tul na plz plz,ham,ham,0.19387886
goodmorning sleeping ga,ham,ham,0.006727929
dear how you are you ok,ham,ham,5.9158312e-05
the world suffers lot not because of the violence of bad people but because of the silence of good people gud night,ham,ham,0.010475946
repeat instructions again wats road name of ur house,ham,ham,0.00053493446
wonders in my world th you th ur style th ur smile th ur personality rd ur nature nd ur sms and st ur lovely friendshiplove dear,ham,ham,0.0041624852
sorry ill call lateri am in meeting,ham,ham,0.00085602375
purity of friendship between two is not about smiling after reading the forwarded messageits about smiling just by seeing the name gud evening and stay blessed,ham,ham,0.0053989333
stop knowing me so well,ham,ham,0.00017518777
she just broke down list of reasons why nobodys in town and cant tell if shes being sarcastic or just faggy,ham,smishing,0.78599066
under the sea there lays rock in the rock there is an envelope in the envelope there is paper on the paper there are words guess,ham,ham,5.949993e-05
save money on wedding lingerie at wwwbridalpetticoatdreamscouk choose from superb selection with national delivery brought to you by weddingfriend,spam,smishing,1.0
yup how noe leh,ham,ham,0.00021136193
ard lor,ham,ham,0.00967377
messagesome text missing sendername missing number missing sentdate missing missing lot thats everything is missing sent via fullonsmscom,ham,ham,0.14867096
well am officially in philosophical hole so if wanna call am at home ready to be saved,ham,ham,0.20470585
like personal sized or what,ham,ham,0.03637843
dear vdafne customeryou are winner of guaranteed caller prize this is our final attempt to contact you to claim call now,smishing,smishing,1.0
only if you promise your getting out as soon as you can and youll text me in the morning to let me know you made it in ok,ham,ham,1.9234301e-05
missing you toopray inshah allah,ham,ham,3.318314e-05
free unlimited hardcore porn direct your mobile txt porn to get free access for hrs then chrgdp per day txt stop exit this msg is free,spam,smishing,1.0
erm woodland avenue somewhere do you get the parish magazine his telephone number will be in there,ham,ham,0.01987497
like made him throw up when we were smoking in our friends car one time it was awesome,ham,ham,0.00022163162
sms ac sptv the new jersey devils and the detroit red wings play ice hockey correct or incorrect end reply end sptv,spam,smishing,1.0
he is there you call and meet him,ham,ham,0.005912448
liked your new house,ham,ham,0.0020386123
im done just studyn in library,ham,ham,5.3061114e-05
may approve panalambut it should have more posts,ham,ham,0.00054506096
ok then will wait for then talk to me,ham,ham,0.002503501
so pay first lar then when is da stock comin,ham,ham,0.0009050515
reply with your name and address and you will receive by post weeks completely free accommodation at various global locations wwwphbcom php,smishing,smishing,1.0
you will go to walmart ill stay,ham,ham,0.0020701191
if you hear loud scream in about ltgt minutes its cause my gyno will be shoving things up me that dont belong,ham,ham,2.5156065e-05
we left already we at orchard now,ham,ham,0.0005664407
missed your call cause was yelling at scrappy miss cant wait for to come home im so lonely today,ham,smishing,0.97895056
my roommate also wants dubsack and another friend may also want some so plan on bringing extra ill tell you when they know for sure,ham,ham,0.00014087248
so when do you wanna gym harri,ham,ham,0.00015064668
yep at dereks house now see you sunday lt,ham,ham,0.0053232373
so do you have samus shoulders yet,ham,ham,0.014507696
aight call me once youre close,ham,ham,0.017378302
its ok noe ure busy but im really too bored so msg oso dunno wat colour she choose me one,ham,ham,0.00012425012
