text,true_label,pred_label,pred_proba
boltblue tones for reply poly or mono eg poly cha cha slide yeah slow jamz toxic come with me or stop more tones txt more,spam,smishing,1.0
thats the thing with apes can fight to the death to keep something but the minute they have it when let go thats it,ham,ham,0.000100047124
you got called tool,ham,ham,5.3914242e-05
stop calling everyone saying might have cancer my throat hurts to talk cant be answering everyones calls if get one more call im not babysitting on monday,ham,smishing,0.99999285
just really need shit before tomorrow and know you wont be awake before like,ham,ham,0.0005913188
still painting ur wall,ham,ham,1.8880712e-05
apple id buxcxgbvwwccod final notification your apple is due to expire today prevent this by confirming your apple id athttpverifyappleuk apple inc,smishing,smishing,1.0
are you planning to come chennai,ham,ham,0.00010250334
im in class will holla later,ham,ham,0.00019804253
lmao ok wont be needing to do my hair anymore,ham,ham,0.00079506484
said its okay sorry,ham,ham,0.00012691287
apple has detected an unauthorized signin to your cloud account if this message goes without reply apple will be forced to suspend your account please verify this icloud device by sending your correct apple id and password via text message,smishing,ham,0.3270805
single line with big meaning miss anything ur best life but dont miss ur best life for anything,ham,ham,0.008227836
goodo yes we must speak friday eggpotato ratio for tortilla needed,ham,ham,0.0027863015
went to ur hon lab but no one is there,ham,ham,0.002876375
this is one of the days you have billion classes right,ham,ham,0.013040948
thank,ham,ham,0.018500324
err cud do im going to at pm havent got way to contact him until then,ham,ham,0.26245695
nova medical centers conducts shoulder pain clinic on mar thconsult our renowned shoulder specialists drmahesh reddy drjatty call,spam,smishing,1.0
hi the sexychat girls are waiting for you to text them text now for great night chatting send stop to stop this service,spam,smishing,0.99979645
there are many company tell me the language,ham,ham,0.00012105736
sorry ill call laterbuzy,ham,ham,0.0002713535
come search tat vidnot finishd,ham,ham,0.020673128
think just yourself thanks and see you tomo,ham,ham,7.629947e-05
im gonna be home soon and dont want to talk about this stuff anymore tonight ileave this topic for now,ham,ham,0.00025444102
call now just per min ntt ltd po box croydon cr wb is national rate call,spam,smishing,1.0
just got outta class gonna go gym,ham,ham,0.0007519983
congratulations ore mo owo re wa enjoy it and wish you many happy moments to and fro wherever you go,ham,ham,0.03514486
yup ok thanx,ham,ham,0.00070626254
your brother is genius,ham,ham,0.0029440527
willing live local to you text reply to hear strt back from me per msg netcollex ltdhelpdesk reply stop to end,spam,smishing,1.0
joys father is john then john is the name of joys father mandan,ham,ham,0.0312208
spoke with uncle john today he strongly feels that you need to sacrifice to keep me here hes going to call you when he does beg you to just listen dont make any promises or make it clear things are not easy and need you to please let us work things out as long as keep expecting help my creativity will be stifled so pls just keep him happy no promises on your part,ham,ham,0.0001505766
know im lacking on most of this particular dramastorms details but for the most part im not worried about that,ham,ham,0.0004723008
we will hold your paytm amount after sometime complete your paytm kyc paytm office ph,smishing,smishing,1.0
someone know has asked our dating service contact you cant guess who call now all will be revealed po box wu,smishing,smishing,1.0
didnt you get hep immunisation in nigeria,ham,ham,3.195117e-05
how much is blackberry bold in nigeria,ham,ham,9.910981e-05
haha good to hear im officially paid and on the market for an th,ham,ham,0.0036063537
private your account statement for shows unredeemed points call identifier code expires,smishing,smishing,1.0
dunno leh cant remember mayb lor so wat time we meeting tmr,ham,ham,0.0002206116
is there reason weve not spoken this year anyways have great week and all the best in your exam,ham,ham,0.0013753624
yeah ill try to scrounge something up,ham,ham,0.014938565
lol for real she told my dad have cancer,ham,ham,0.00068112015
okthats fine,ham,ham,5.745144e-05
how is your schedule next week am out of town this weekend,ham,ham,0.0019396704
uploaded mine to facebook,ham,ham,1.4353317e-05
nationwide has noticed your debit card was recently used on at apple online store for gbp if not you please urgently call fraud prevention on or int do not reply by sms httpwwwnationwidecouk,smishing,smishing,0.99589396
sorry ill call later at mins,ham,ham,0.06309079
hey girl how hope well me an del bak again long time no give me call sum time from lucyxx,ham,ham,0.03903086
is toshiba portege gd,ham,smishing,0.8609342
hanks lotsly,ham,ham,0.0025786245
derp which is worse dude who always wants to party or dude who files complaint about the three drug abusers he lives with,ham,smishing,0.9999049
same as kallis dismissial in nd test,ham,ham,0.00044898724
had the money issue weigh me down but thanks to you can breathe easier now ill make sure you dont regret it thanks,ham,ham,5.416784e-05
dad says hurry the hell up,ham,ham,9.930299e-05
were finally ready fyi,ham,ham,0.0006292762
as valued customer am pleased to advise you that following recent review of your mob no you are awarded with bonus prize call,smishing,smishing,1.0
yes please leave at ltgt so that at ltgt we can leave,ham,ham,0.00038453087
urgent your mobile number has been awarded with inr prize guaranteed call from land line claim valid hrs only,smishing,smishing,1.0
hot live fantasies call now just per min ntt ltd po box croydon cr wb,spam,smishing,1.0
need an th but im off campus atm could pick up in an hour or two,ham,ham,0.010803609
any chance you might have had with me evaporated as soon as you violated my privacy by stealing my phone number from your employers paperwork not cool at all please do not contact me again or will report you to your supervisor,ham,smishing,1.0
tomarrow want to got to court at ltdecimalgt so you come to bus stand at,ham,smishing,0.9458296
some of them told accenture is not confirm is it true,ham,ham,0.0006472203
got lousy sleep kept waking up every hours to see if my cat wanted to come in worry about him when its cold,ham,ham,9.482361e-05
shall ask one thing if you dont mistake me,ham,ham,6.352025e-05
kdo it at evening daurgent,ham,ham,8.324061e-06
sms services for your inclusive text credits pls goto wwwcomuknet login qxj unsubscribe with stop no extra charge help comuk cm ae,spam,smishing,1.0
hii got the money da,ham,ham,6.4411615e-05
im hungry buy smth home,ham,ham,0.00035406367
where did go my phone is gonna die you have to stay in here,ham,ham,0.0037263862
can you plz tell me the ans bslvyl sent via fullonsmscom,ham,ham,0.0057861656
yes watching footie but worried were going to blow it phil neville,ham,ham,0.018234659
how do friends help us in problems they give the most stupid suggestion that lands us into another problem and helps us forgt the previous problem,ham,ham,0.00022420379
no prob will send to your email,ham,ham,0.24201535
kkfrom tomorrow onwards started ah,ham,smishing,0.69942766
then drive lor,ham,ham,0.00019004023
nobut heard abt tat,ham,ham,4.91808e-05
sure but make sure he knows we aint smokin yet,ham,ham,0.00016009287
aight let me know when youre gonna be around usf,ham,ham,0.00018913511
are you still playing with gautham,ham,ham,0.0002338538
hav almost reached call unable to connect,ham,smishing,0.9955396
umma did she say anything,ham,ham,0.00021513313
alrite sam its nic just checkin that this is ur numberso is ittb,ham,ham,0.07829757
oh only outside players allowed to play know,ham,ham,0.0014534655
dear customer your paytmkyc has been expired its will be blcked within hour please contact customer care ph immediately to verify,smishing,smishing,1.0
no dice art class thru thanks though any idea what time should come tomorrow,ham,ham,0.0021811165
text get more ringtones logos and games from wwwtxtcom questions infotxtcouk,spam,ham,0.08855495
jason says hes gonna be around so ill be up there around ltgt,ham,ham,0.00018109956
babe how goes that day what are you doing where are you sip my cappuccino and think of you my love send kiss to you from across the sea,ham,smishing,0.9843938
even my brother is not like to speak with me they treat me like aids patent,ham,ham,3.461956e-05
freemsg fancy flirt reply date now join the uks fastest growing mobile dating service msgs rcvd just to optout txt stop to reply date now,spam,smishing,1.0
what im saying is if you havent explicitly told nora know someone im probably just not gonna bother,ham,ham,0.0068366383
ill hand her my phone to chat wit,ham,ham,0.0076843966
er yep sure props,ham,ham,0.0035439818
got itmail panren paru,ham,ham,3.4152705e-05
thanx today cer it was nice catch up but we ave find more time more often oh well take care soonc,ham,ham,0.0018778408
wake up already wat doing picking us up later rite im taking sq reaching ard smth like dat can check arrival time ya soon,ham,ham,0.004302071
hi the way was with day is the normal waythis is the real me ur uniquei hope know the rest of mylife hope find wot was lost,ham,ham,0.0075969878
ive been searching for the right words to thank you for this breather promise wont take your help for granted and will fulfil my promise you have been wonderful and blessing at all times,ham,ham,0.11891599
this message is free welcome to the new improved sex dogging club to unsubscribe from this service reply stop msgsp only,spam,smishing,1.0
can help swoop by picking up from wherever ur other birds meeting if want,ham,ham,0.00044266955
gud mrng dear hav nice day,ham,ham,0.009958227
sorry flaked last night shits seriously goin down with my roommate what you up to tonight,ham,ham,0.00035020383
im in office now dawhere are you,ham,ham,0.033556096
that sucks ill go over so can do my hair youll do it free right,ham,ham,3.9025414e-05
xclusiveclubsaisai morow soiree speciale zouk with nichols from parisfree roses all ladies info,smishing,ham,0.0058126636
local covid study compensation up to qualify herecashstudycom,smishing,ham,0.00015615455
great so what attracts you to the brothas,ham,ham,3.775637e-05
are you the cutest girl in the world or what,ham,ham,0.0007868407
can you use foreign stamps for whatever you send them off for,ham,ham,0.0070191403
hope you arnt pissed off but id would really like to see you tomorrow love me xxxxxxxxxxxxxx,ham,ham,0.01331561
ok anyway no need to change with what you said,ham,ham,0.0006935767
with my sis lor we juz watched italian job,ham,ham,0.000117511736
mah ill pick it up tomorrow,ham,ham,8.9698835e-05
hey darlin can pick up at college if tell me wen where mt love pete xx,ham,ham,0.000101006764
enjoy the jamster videosound gold club with your credits for new videosounds logosmusicnews get more fun from jamstercouk only help call,spam,smishing,0.9999198
no rushing im not working im in school so if we rush we go hungry,ham,ham,0.00046302384
still working now,ham,ham,0.00052598224
atm blockdear customer due to our system upgrade your atm card has just been deactivated to reactivate call customer care for help now,smishing,smishing,1.0
this phone has the weirdest auto correct,ham,ham,0.13143684
wonder if your phone battery went dead had to tell you love you babe,ham,ham,0.00017008488
what mean almost done done wif sleeping but tot going to take nap yup send her liao so im picking her up at ard smth lor,ham,ham,0.00073136465
ok but bag again,ham,ham,6.223966e-05
and you will expect you whenever you text hope all goes well tomo,ham,ham,0.0013135868
so gonna get deus ex,ham,ham,0.0003169837
short but cute be good person but dont try to prove it good morning,ham,ham,0.000112678266
orange customer you may now claim your free camera phone upgrade for your loyalty call now on offer ends thmarch tcs apply optout availa,smishing,smishing,1.0
free entry in wkly comp to win fa cup final tkts st may text fa to to receive entry questionstd txt ratetcs apply overs,spam,smishing,1.0
im done oredi,ham,ham,0.00013665663
you said to me before went back to bed that you cant sleep for anything,ham,ham,0.00082174677
have secret admirer who is looking make contact with ufind out who they rreveal who thinks ur so specialcall on,smishing,ham,0.08051613
sms ac blind date rodds is from aberdeen united kingdom check him out httpimg sms acwicmbcktzr no blind dates send hide,smishing,ham,0.28903285
wait will msg after ltgt min,ham,ham,0.00040542881
ffffffffff alright no way can meet up with you sooner,ham,ham,0.00016189275
how are you my love are you with your brother time to talk english with him grins say hey muhommad penny says hello from across the sea,ham,ham,0.007287428
thats significant but dont worry,ham,ham,8.4141146e-05
is she replying has boye changed his phone number,ham,ham,0.13195501
how noe shes in da car now later then lar im wearing shorts,ham,ham,0.00069456885
near kalainar tv officethenampet,ham,ham,0.00012020431
storming msg wen lift phne say hello do knw wt is real meaning of hello its name of girl yes and knw who is dat girl margaret hello she is girlfrnd grahmbell who invnted telphone,ham,ham,0.00022529517
sms services for your inclusive text credits pls goto wwwcomuknet login unsubscribe with stop no extra charge help po box ip we,spam,smishing,1.0
hey what happen de are you alright,ham,ham,0.00016972004
you have been specially selected to receive pound award call before the lines close cost ppm tcs apply ag promo,smishing,smishing,1.0
aiyo so poor thing then dun wan eat bathe already,ham,ham,0.0065209945
wat time do wan meet me later,ham,ham,6.907663e-05
id have to check but theres only like bowls worth left,ham,ham,0.0020776244
yep the great loxahatchee xmas tree burning of ltgt starts in an hour,ham,ham,0.0001655473
sms auction brand new nokia is up auction today auction is free join take part txt nokia to now hgsuitelands rowwjhl,spam,smishing,1.0
not free today haf pick my parents up tonite,ham,ham,0.00048508137
if youre thinking of lifting me one then no,ham,ham,1.2121652e-05
this is wishing you great day moji told me about your offer and as always was speechless you offer so easily to go to great lengths on my behalf and its stunning my exam is next friday after that will keep in touch more sorry,ham,ham,0.29051244
oh was thkin of goin yogasana at den no nd to go at den can rush to parco nb okie lor call me when ready,ham,smishing,0.99994445
machan you go to gym tomorrow wil come late goodnight,ham,ham,0.0022501508
hey ive booked the lessons on sun liao,ham,ham,0.00050795963
aight lemme know whats up,ham,ham,0.00020794118
oh icic lor den meet other day,ham,ham,0.00070147484
january male sale hot gay chat now cheaper call national rate from pmin cheap to pmin peak to stop texts call pmin,spam,smishing,1.0
dont run away frm walk slowly amp it kills me that dont care enough to stop me,ham,ham,0.0397785
did you see that film,ham,ham,9.2406146e-05
subscribe to weekly ringtoneget st week freesend subpoly to per weekstop sms,spam,smishing,0.9999713
whats up bruv hope you had great break do have rewarding semester,ham,ham,0.001228025
excellent wish we were together right now,ham,ham,0.0029118904
just dropped em off omw back now,ham,ham,0.011177045
sorry about that this is my mates phone and didnt write it love kate,ham,ham,5.6238572e-05
thats shame maybe cld meet for few hrs tomo,ham,ham,0.008465444
dear sirsalam alaikkumpride and pleasure meeting you today at the tea shopwe are pleased to send you our contact number at qatarrakhesh an indianpls save our numberrespectful regards,ham,smishing,1.0
when login dat time dad fetching home now,ham,ham,0.00086568395
friendship poem dear dear not near but can hear dont get fear live with cheer no more tear always my dear gud ni,ham,ham,0.00013502366
im working technical support voice process,ham,ham,0.0058412096
oh god am happy to see your message after days,ham,ham,0.37065214
yeah so basically any time next week you can get away from your mom amp get up before,ham,ham,0.011782001
mths half price orange line rental latest camera phones free had your phone mths call mobilesdirect free on to update now orstoptxt,spam,smishing,1.0
very strange and are watching the nd one now but im in bed sweet dreams miss,ham,ham,0.0020589218
lol they were mad at first but then they woke up and gave in,ham,ham,1.9556634e-05
jay told me already will do,ham,ham,0.00017957608
no on the way home so if not for the long dry spell the season would have been over,ham,ham,0.012252939
sorry da thangamits my mistake,ham,ham,7.22083e-06
what time you coming down later,ham,ham,0.00011188339
im home,ham,ham,0.00041176286
ok ill do you right later,ham,ham,3.6668975e-05
aldrine rakhesh ex rtm herepls callurgent,ham,smishing,1.0
theres someone here that has year ltgt toyota camry like mr olayiwolas own mileage is ltgt kits clean but need to know how much will it sell for if can raise the dough for it how soon after landing will it sell holla back,ham,ham,6.033258e-05
have you heard about that job im going to that wildlife talk again tonight if wantcome its thatworzels and wizzle or whatever it is,ham,ham,0.00063411065
have your lunch and come quickly and open the door,ham,ham,3.608886e-05
today is accept dayu accept me as,ham,ham,0.00045084645
have to take exam with march,ham,ham,0.0015090916
yup song bro no creative neva test quality he said check review online,ham,ham,0.0039225663
they will pick up and drop in carso no problem,ham,ham,3.3607175e-05
wan to go there doctor,ham,ham,0.0016862024
left dessert wan me go suntec look,ham,ham,0.0010934622
oh is it send me the address,ham,ham,0.00019686509
what time wrkin,ham,ham,0.00019167003
hi my engagement has been fixd on ltgt th of next month know its really shocking bthmm njan vilikkamt ws al of sudn,ham,ham,0.02239168
ya had just nowonion roast,ham,ham,0.018966429
yeshe is really greatbhaji told kallis best cricketer after sachin in worldvery tough to get out,ham,ham,0.004823153
reat deals at the mobilestore get rs off on mobile purchases above rs rush offer valid till st feb show mcoupon rpd,spam,smishing,1.0
cthen thk shd enuff still got conclusion contents pg references ill doing da contents pg cover pg,ham,smishing,1.0
eh remember how spell his name yes did he have been naughty until have met him,ham,ham,0.1375812
welcome please reply with your age and gender to begin eg,spam,smishing,1.0
sorry sir will call you tomorrow senthilhsbc,ham,ham,0.34380123
this is all just creepy and crazy to me,ham,ham,6.39477e-05
hi finally completed the course,ham,ham,0.000111740424
sorry not now,ham,ham,0.00028160147
urgent your costa del sol holiday or await collection call now toclaim sae tc pobox stockport skxh costpm maxmins,smishing,smishing,1.0
hey dont forget you are mine for me my possession my property mmm childish smile,ham,ham,0.0016195495
oh kkwhere did you take test,ham,ham,6.343327e-05
no its truekdo knw dis no ltgt,ham,smishing,0.6103908
im really sorry wont able do this fridayhope can find an alternativehope yr terms going ok,ham,ham,8.277988e-06
bognor it is should be splendid at this time of year,ham,ham,0.0001102708
you have won nokia this is what you get when you win our free auction to take part send nokia to now hgsuitelands rowwjhl,smishing,smishing,1.0
after completed degree there is no use in joining finance,ham,ham,0.0015855787
yeah you should think you can use your gt atm now to register not sure but if theres anyway can help let me know but when you do be sure you are ready,ham,ham,0.0002452268
yeah dont see why not,ham,ham,0.00018950968
your opinion about me oversmart selfish naughy lovable silent special immature stylish simple pls reply,ham,ham,0.0006750459
am not working but am up to eyes in philosophy so will text later when bit more free for chat,ham,ham,0.26934263
can not,ham,ham,0.00046348394
sorry ill call later ok bye,ham,ham,0.067052856
good good job like entrepreneurs,ham,ham,0.00012503359
know you are serving mean what are you doing now,ham,ham,8.7901084e-05
sorry me going home first daddy come fetch later,ham,ham,0.00029459514
no no will check all rooms befor activitiesthats required,ham,ham,0.04206499
sorry my battery died can come by but im only getting gram for now wheres your place,ham,ham,0.053776845
sorry dont knw,ham,ham,0.0002738271
wat time wan today,ham,ham,0.00012614853
send his number and give reply tomorrow morning for why you said that to him like that ok,ham,ham,0.0005023846
loa homeowners tenants welcome have you been previously refused we can still help call free or text back help,smishing,smishing,1.0
finished my lunch already wake up already,ham,ham,0.0002782813
wanna get laid nite want real dogging locations sent direct to ur mobile join the uks largest dogging network txt park to now nyt eca lp msg,spam,smishing,1.0
dhoni have luck to win some big titleso we will win,ham,smishing,0.9962715
ok both our days so what are you making for dinner tonite am invited,ham,ham,0.005737919
feel like dick because keep sleeping through your texts and facebook messages sup you in town,ham,ham,0.003596773
my mobile numberpls sms ur mail idconvey regards to achanammarakheshqatar,ham,ham,0.11032228
full heat pa have applyed oil pa,ham,ham,0.07333068
you ve won your costa del sol holiday or await collection call now toclaim sae tc pobox stockport skxh costpm maxmins,smishing,smishing,1.0
sounds like you have many talents would you like to go on dinner date next week,ham,ham,0.012111369
his bday real is in april,ham,ham,0.0007240235
hello my love how goes that day wish your well and fine babe and hope that you find some job prospects miss you boytoy teasing kiss,ham,ham,0.00015470834
me not waking up until in the afternoon sup,ham,ham,0.00020664737
fantasy football is back on your tv go to sky gamestar on sky active and play dream team register nowsky opt out to,spam,smishing,0.99811244
except theres chick with huge boobs,ham,ham,0.0638141
youhv completed transaction for aud on pm please follow the link if it is not done by you httpcommbanknetban,smishing,ham,0.033779293
you should change your fb to jaykwon thuglyfe falconerf,ham,smishing,1.0
oktake careumma to you too,ham,ham,0.001808932
ujhhhhhhh computer shipped out with address to sandiago and parantella lane wtf poop,ham,smishing,0.9657996
rediscover the deeper meaning of life and the means to attain true peace understand the essence of being true sikh sms join gurubani to,spam,smishing,0.9997452
there is no sense in my foot and penis,ham,ham,3.527374e-05
hmmbad newshype park plaza studio takenonly left bedrm,ham,smishing,1.0
as valued customer am pleased to advise you that following recent review of your mob no you are awarded with bonus prize call,smishing,smishing,1.0
hi you just spoke to maneesha if you were satisfied with the experience reply with yes else no,ham,ham,0.1837635
text me when youre on the way,ham,ham,0.00027862485
you didnt hear it from me,ham,ham,8.2723884e-05
what is important is that you prevent dehydration by giving her enough fluids,ham,ham,0.0006738613
double mins double txt price call mobileupd for the very latest offers or calloptoutlf,spam,smishing,1.0
christmas is an occasion that is celebrated as reflection of ur values desires affectionsamp traditions have an ideal christmas,ham,ham,0.0032172245
play computer aiyah tok lor,ham,ham,0.022173237
well at this right im gonna have to get up and check todays steam salespee so text me when you want me to come get you,ham,ham,0.00028545072
think ive fixed it can you send test message,ham,ham,0.00012718691
famous quote when you develop the ability to listen to anything unconditionally without losing your temper or self confidence it means you are married,ham,smishing,1.0
all sounds good fingers makes it difficult to type,ham,ham,0.0005577812
please complete registration process before using any service code tid,spam,smishing,0.99975413
hui xin is in da lib,ham,ham,1.9269992e-05
do you want new video phone anytime any network mins text for only five pounds per week call now or reply for delivery tomorrow,smishing,smishing,1.0
reminder you have not downloaded the content you have already paid for goto httpdoit mymoby tv to collect your content,smishing,smishing,0.9524724
dont quite know what to do still cant get hold of anyone cud pick you up bout pm and we can see if theyre in the pub,ham,ham,3.1551248e-05
good morning im suffering from fever and dysentry will not be able to come to office today,ham,smishing,0.84411645
hi baby im cruisin with my girl friend what up give me call in and hour at home if thats alright or fone me on this fone now love jenny xxx,ham,ham,0.0067804335
all well,ham,ham,0.00054498675
ok will message before leave my house,ham,ham,0.0003168396
no nokia tone ur mob every week just txt nokia to get txting and tell ur mates wwwgetzedcouk pobox wwq normptone,spam,smishing,1.0
hmmm thought we said hours slave not you are late how should punish you,ham,ham,0.00031049564
im going out to buy mums present ar,ham,ham,0.00421184
cant pick the phone right now will call later,ham,smishing,0.5737556
dude we should go sup again,ham,ham,0.00025074056
dear am not denying your words please,ham,ham,1.49975485e-05
but really quite funny lor wat then shd haf run shorter distance wat,ham,ham,0.029952016
how much did ur hdd casing cost,ham,ham,0.014400714
send this to ur friends and receive something about ur voice how is my speaking expression childish naughty sentiment rowdy ful of attitude romantic shy attractive funny ltgt irritating ltgt lovable reply me,ham,ham,0.057493784
celebrate my bday else,ham,ham,4.141893e-05
if you at home then am coming within mins,ham,ham,0.0014727553
