text,true_label,pred_label,pred_proba
if you at home then am coming within mins,ham,ham,0.02149687
ok ive sent da latest version of da project,ham,ham,0.037601165
hahahause your brain dearthats important,ham,ham,0.063950874
sure am in my relatives home sms me de pls,ham,ham,0.021637086
best line said in love will wait till the day can forget or the day realize that cannot forget me gn,ham,ham,0.31870595
no current and food here am alone also,ham,ham,0.025910512
tell them the drug dealers getting impatient,ham,ham,0.02335524
will come tomorrow di,ham,ham,0.00200524
im aight wats happening on your side,ham,ham,0.01711989
its ok my arm is feeling weak cuz got shot so we can go another time,ham,ham,0.056761287
hey iouri gave me your number im wylie ryans friend,ham,ham,0.054186676
have you ever had one foot before,ham,ham,0.029569266
leave it de start prepare for next,ham,ham,0.05908529
dear paytm customer your paytm kyc has expired contact customer care no immediately your account will block within hr thank you paytm team,smishing,smishing,0.81024015
am late will be there by,ham,ham,0.005145756
hmm shall bring bottle of wine to keep us amused just joking ill still bring bottle red or white see you tomorrow,ham,ham,0.4949651
your right ill make the appointment right now,ham,ham,0.03439264
todays voda numbers ending are selected to receive award if you hava match please call quoting claim code standard rates app,smishing,smishing,0.996702
urgent you have won week free membership in our prize jackpot txt the word claim to no tc wwwdbuknet lccltd pobox ldnwarw,smishing,smishing,0.9750334
yes its all innocent fun,ham,ham,0.0050609345
hello darling how are you today would love to have chat why dont you tell me what you look like and what you are in to sexy,spam,ham,0.22444923
am joining today formallypls keep prayingwill talk later,ham,ham,0.12963828
think could stop by in like an hour or so my roommates looking to stock up for trip,ham,ham,0.09593583
call me when finish then come pick,ham,ham,0.013673218
me dont know again oh,ham,ham,0.0039490946
did find out what time the bus is at coz need to sort some stuff out,ham,ham,0.13459934
its reassuring in this crazy world,ham,ham,0.0025054654
boy was late home his father power of frndship,ham,ham,0.03929785
urgent this is our nd attempt to contact your prize from yesterday is still awaiting collection to claim call now,smishing,smishing,0.7583393
urgent we are trying to contact you last weekends draw shows have won prize guaranteed call claim code valid hrs pm,smishing,smishing,0.99969125
then get some cash together and ill text jason,ham,ham,0.024708994
its to get in is that ok,ham,ham,0.0050711995
bmo have noticed unusual activites on your online account you are required to verify your account detailswwwbmotk,smishing,ham,0.29065117
ok then ill let him noe later ask him call tmr,ham,ham,0.23543446
good morning plz call me sir,ham,ham,0.028968623
you have won cash or prize to claim call,smishing,ham,0.18402447
no nothis is kallis home groundamla home town is durban,ham,ham,0.25335804
aiyo cos sms then neva reply so wait to reply lar tot havent finish ur lab wat,ham,smishing,0.55358
dont search love let love find thats why its called falling in love,ham,ham,0.16868168
thats one of the issues but california is okay no snow so its manageable,ham,ham,0.031855356
nothing much chillin at home any super bowl plan,ham,ham,0.0957058
free video camera phones with half price line rental for mths and cross ntwk mins txts call mobileupd,spam,smishing,0.95914453
hey happy birthday,ham,ham,0.0020364502
please call our customer service representative on between ampm as you have wn guaranteed cash prize of rs flpkart team,smishing,smishing,0.8534905
can get phone now wanna chat set up meet call me now on can cum here moro luv jane xx callsminmoremobsemspoboxpowa,spam,smishing,0.9741241
sounds gd haha can wah yan jiu so fast liao,ham,ham,0.07642539
am on the way to office,ham,ham,0.0039048013
am taking half day leave bec am not well,ham,ham,0.033058
wait do you know if wesleys in town bet she does hella drugs,ham,ham,0.16792311
yeah probably still gotta check out with leo,ham,ham,0.02934253
get the official england poly ringtone or colour flag on yer mobile for tonights game text tone or flag to,spam,smishing,0.7963297
horrible gal knew dat was going out wif him yest still come ask me,ham,ham,0.103468925
wants to know where you are,ham,ham,0.003928529
someone has contacted our dating service and entered your phone becausethey fancy you to find out who it is call from landline pobox wrg,smishing,smishing,0.8487776
what mean is do they come chase you out when its over or is it stated you can watch as many movies as you want,ham,ham,0.24968229
sure theyll understand that wine good idea just had slurp,ham,ham,0.018025745
honey can you pls find out how much they sell predicte in nigeria and how many times can it be used its very important to have reply before monday,ham,smishing,0.5063307
convey my regards to himall the best,ham,ham,0.008428876
yup he msg me is tat yijue then tot its my group mate cos we meeting today mah im askin if leaving earlier or wat mah cos mayb haf to walk far,ham,smishing,0.7105562
turns out my friends are staying for the whole show and wont be back til some time so feel free to go ahead and smoke that worth worth,ham,ham,0.38257745
when people see my msgs they think iam addicted to msging they are wrong bcoz they dont know that iam addicted to my sweet friends,ham,ham,0.31874362
nt yet chikkusimple habbahw abt,ham,ham,0.06886959
that was random saw my old roomate on campus he graduated,ham,ham,0.04084422
good evening sir hope you are having nice day wanted to bring it to your notice that have been late in paying rent for the past few months and have had to pay ltgt charge felt it would be inconsiderate of me to nag about something you give at great cost to yourself and thats why didnt speak up however am in recession and wont be able to pay the charge this month hence my askin well ahead of months end can you please help thank you for everything,ham,ham,0.26742432
nothing just getting msgs by dis name wit different nos,ham,ham,0.44637412
so the sun is anti sleep medicine,ham,ham,0.035416972
hurry home soup is done,ham,ham,0.0041301376
life is more strict than teacher bcoz teacher teaches lesson amp then conducts exam but life first conducts exam amp then teaches lessons happy morning,ham,smishing,0.81888556
free any day but finish at on mon thurs,ham,ham,0.019968852
ok im waliking ard now do wan me buy anything go ur house,ham,ham,0.13341178
hicts employee how are you,ham,ham,0.0009550947
yesim in office da,ham,ham,0.0008018865
please stay at home to encourage the notion of staying at home all taxpaying citizens are entitled to or more emergency refund smsgiofcvbd,smishing,smishing,0.7415694
just hopeing that wasnt too pissed up to remember and has gone off to his sisters or something,ham,smishing,0.60316557
how its little difficult but its simple way to enter this place,ham,ham,0.09922638
cant feel nauseous im so pissed didnt eat any sweets all week cause today was planning to pig out was dieting all week and now im not hungry,ham,ham,0.3304368
you are winner you have been specially selected to receive cash or award speak to live operator to claim call ampm cost,smishing,smishing,0.862369
how are have missed havent been up much bit bored with the holiday want go bak college sad isnt itxx,ham,smishing,0.93214244
as one of our registered subscribers can enter the draw gb gift voucher by replying with enter to unsubscribe text stop,spam,smishing,0.6185675
sorry you never hear unless you book it one was kinda jokethet were really looking for skinny white girls the other was one lineyou can only do so much on camera with that something like that theyre casting on the look,ham,ham,0.3918683
think you should go the honesty road call the bank tomorrow its the tough decisions that make us great people,ham,ham,0.31149852
no probs hon how doinat the mo,ham,ham,0.008802089
frnd not juz wordnot merely relationshipits silent promise which says will be with you wherevr whenevr forevr gudnyt dear,ham,ham,0.40473542
at home watching tv lor,ham,ham,0.010374564
it could work well reach consensus at the next meeting,ham,ham,0.043180786
no plm will come da on the way,ham,ham,0.017012767
well done and luv ya all,ham,ham,0.010674756
urgent this is the nd attempt to contact uu have won call tcsbcmwcnxxcallcostppmmobilesvary max,smishing,smishing,0.5571322
which is weird because know had it at one point,ham,ham,0.0114035895
good afternoon my love how goes your day what are you up to woke early and am online waiting for you hmmm italian boy is online see grins,ham,ham,0.41783622
aiyah ok wat as long as got improve can already wat,ham,ham,0.021855576
you have won guaranteed award or even cashto claim ur award call free on stop getstop on php rg jx,smishing,smishing,0.78730124
cos want it to be your thing,ham,ham,0.0056443997
shes fine have had difficulties with her phone it works with mine can you pls send her another friend request,ham,smishing,0.5640299
thinkin about someone is all good no drugs for that,ham,ham,0.024183258
my parents my kidz my friends my colleagues all screaming surprise,ham,ham,0.01736799
wot wanna do then missy,ham,ham,0.005348157
had your mobile mths update to the latest cameravideo phones for free keep ur same number get extra free minstexts text yes for call,spam,smishing,0.7396278
tell rob to mack his gf in the theater,ham,ham,0.012573832
watching cartoon listening music amp at eve had to go temple amp church what about,ham,ham,0.4889875
do not late love mum,ham,ham,0.0055321967
played smash bros ltgt religiously,ham,ham,0.005559734
englishvocabulary ululate to mourn loudly and shrilly ad unlimited free calls to any mobile try out today httpbitlyunlmtdfreecall share wid frnd,smishing,smishing,0.6120216
yar tot knew dis would happen long ago already,ham,smishing,0.6138934
where you what happen,ham,ham,0.0013367127
couldnt say no as he is dying man and feel sad for him so will go and just wanted you to know would probably be gone late into your night,ham,smishing,0.72069806
hi babe its jordan how im home from abroad and lonely text me back if wanna chat xxsp visionsmscom text stop to stopcost,spam,ham,0.3794127
dai what this da can send my resume to this id,ham,ham,0.008553403
know but you need to get hotel now just got my invitation but had to apologise cali is to sweet for me to come to some english blokes weddin,ham,smishing,0.5674975
dear voucher holder to claim this weeks offer at you pc please go to httpwwwetlpcoukreward tscs apply,smishing,smishing,0.6307167
you in your room need few,ham,ham,0.007686592
love you sushmalove lot,ham,ham,0.0015202153
hes in lag thats just the sad part but we keep in touch thanks to skype,ham,ham,0.08063986
that seems unnecessarily hostile,ham,ham,0.009309814
im ok will do my part tomorrow,ham,ham,0.005523947
so your telling me coulda been your real valentine and wasnt never pick me for nothing,ham,ham,0.363577
do you know when dad will be back,ham,ham,0.0058058174
okie thanx,ham,ham,0.04864933
where are you you said you would be here when woke,ham,ham,0.018030092
dont think he has spatula hands,ham,ham,0.0055889203
no it will reach by only she telling she will be there dont know,ham,ham,0.044909038
ummmawill call after check inour life will begin from qatar so pls pray very hard,ham,smishing,0.73344713
so what do you guys do,ham,ham,0.0035029508
then she buying today no need to meh,ham,ham,0.010410991
gud mrng dear hav nice daydo wellstay blessed,ham,ham,0.4616736
urgent you have won week free membership in our prize jackpot txt the word claim to no tc wwwdbuknet,smishing,smishing,0.5797176
cool do you like swimming have pool and jacuzzi at my house,ham,ham,0.009556867
want new video phone anytime any network mins half price line rental free text for months reply or call for free delivery,spam,smishing,0.77788246
still havent got urself jacket ah,ham,ham,0.040685993
is xy going lunch,ham,ham,0.0034729291
sorry dude dont know how forgot even after dan reminded me sorry hope you guys had fun,ham,ham,0.36510685
thk shd be ok he said plus minus did leave line in between paragraphs,ham,ham,0.20216198
in fact when do you leave think addie goes back to school tues or wed,ham,ham,0.3691701
it certainly puts things into perspective when something like this happens,ham,ham,0.09183299
im cool ta luv but vtired cause have been doin loads of planning all wk we have got our social services inspection at the nursery take care spk sn,ham,smishing,0.64678365
sometimes heart remembrs someone very much forgets someone soon bcoz heart will not like everyone but liked ones will be remembered everytime bslvyl,ham,smishing,0.7560551
yeah should be able to ill text you when im ready to meet up,ham,ham,0.053750582
ok thanx gd nite too,ham,ham,0.03745363
was playng doors game and gt racing on phone lol,ham,ham,0.062185243
cashbincouk get lots of cash this weekend wwwcashbincouk dear welcome to the weekend we have got our biggest and best ever cash give away these,spam,smishing,0.93931806
should send you naughty pix,ham,ham,0.0060117138
think might have to give it miss am teaching til twelve then have lecture at two damn this working thing,ham,smishing,0.67884487
now project pa after that only can come,ham,ham,0.04269083
st wk free gr tones str each wk txt nokia on to for classic nokia tones or hit on to for polys nokiap polyp,spam,smishing,0.6964336
haha okay today weekend leh,ham,ham,0.019780766
ill let you know when it kicks in,ham,ham,0.006186968
sthis will increase the chance of winning,ham,ham,0.006074225
dear paytmcustomer your paytm kyc has been suspended paytm office ph your paytm ac will block within hr thank you,smishing,smishing,0.97418445
gal boy walking in park galcan hold ur hand boyy do think would run away galno jst wana how it feels walking in heaven with an princegn,ham,smishing,0.50063527
sorry ill call later in meeting any thing related to trade please call arul ltgt,ham,ham,0.3256089
yo guess what just dropped,ham,ham,0.0072570564
urgent this is the nd attempt to contact uu have won call tcsbcmwcnxx callcost ppm mobilesvary max,smishing,smishing,0.9340373
nonenowhere ikno doesdiscountshitinnit,ham,ham,0.029916516
thats cool am gentleman and will treat you with dignity and respect,ham,ham,0.028388686
did got that persons storyall well,ham,ham,0.009381421
yes obviously but you are the eggspert and the potato head speak soon,ham,ham,0.024186792
last chance claim ur worth of discount vouchers today text shop to now,smishing,ham,0.3955104
at the funeral home with audrey and dad,ham,ham,0.00679496
was nice day and impressively was sensible went home early and now feel fine or am just boring whens yours cant remember,ham,smishing,0.617296
can you please send me my auntys number,ham,ham,0.0077313636
dont know same thing thats wrong everyso often he panicks starts goin on bout not bein good enough,ham,ham,0.33794278
am in escape theatre now going to watch kavalan in few minutes,ham,ham,0.06126742
oh ki think most of wi and nz players unsold,ham,ham,0.07685481
thats necessarily respectful,ham,ham,0.0044658585
want to funk up ur fone with weekly new tone reply tonesu this text wwwringtonescouk the original best,spam,ham,0.34570426
bankofamerica alert please follow httpbitdocgjkand reactivate,smishing,ham,0.016779715
are you wet right now,ham,ham,0.010136338
sure if get an acknowledgement from you that its astoundingly tactless and generally faggy to demand blood oath fo,ham,ham,0.24290776
lol alright was thinkin that too haha,ham,ham,0.008723928
have lovely night and when you wake up to see this message hope you smile knowing all is as should be have great morning,ham,ham,0.35978281
today iz yellow rose day if love my frndship give me misscall amp send this to ur frndz amp see how many miss calls get if get missed marry ur lover,ham,smishing,0.6950421
kick off new season with wks free goals news to ur mobile txt ur club name to eg villa to,spam,smishing,0.8857654
better made up for friday and stuffed myself like pig yesterday now feel bleh but at least its not writhing pain kind of bleh,ham,ham,0.4787849
tmobile customer you may now claim your free camera phone upgrade pay go sim card for your loyalty call on offer ends thfebtcs apply,smishing,smishing,0.774925
now get rid of cockroach termite bedbug rats any pest best deals in pestcontrolservices chemicalherbalodorless dialnask,spam,ham,0.3296557
having lunch alone now so bored,ham,ham,0.0073820557
ok set let noe details later,ham,ham,0.19079483
am in tirupur da once you started from office call me,ham,ham,0.16567929
hello they are going to the village pub at so either come here or there accordingly ok,ham,ham,0.19255291
didnt get anything da,ham,ham,0.001420217
meanwhile in the shit suite xavier decided to give us ltgt seconds of warning that samantha was coming over and is playing jays guitar to impress her or some shit also dont think doug realizes dont live here anymore,ham,ham,0.39715162
of cos can lar im not so ba dao ok pm lor never ask where we go ah said would ask on fri but he said will ask today,ham,ham,0.41496316
valentines day special win over in our quiz and take your partner on the trip of lifetime send go to now pmsg rcvd custcare,spam,smishing,0.5800201
new mobiles from must go txt nokia to no collect yours todayfrom only wwwtcbiz optout gbpmtmsg,smishing,smishing,0.8738634
loan for any purpose homeowners tenants welcome have you been previously refused we can still help call free or text back help,smishing,smishing,0.64513844
dunno da next show aft is toa payoh got,ham,ham,0.21416543
mum not going robinson already,ham,ham,0.0026125556
sleeping nt feeling well,ham,ham,0.033503566
are you plans with your family set in stone,ham,ham,0.019812774
babe lost you will you try rebooting,ham,ham,0.004462036
wat time finish ur lect today,ham,ham,0.005433446
todays voda numbers ending are selected to receive award if you have match please call quoting claim code standard rates app,smishing,smishing,0.996626
aight we can pick some up you open before tonight,ham,ham,0.02805152
those were my exact intentions,ham,ham,0.004867632
min later,ham,ham,0.006793058
hmm yeah if your not too grooved out and im looking forward to my pound special,ham,ham,0.047068723
idea will soon get converted to live,ham,ham,0.010337534
hi darlin did youphone me im athome if youwanna chat,ham,ham,0.013086824
yeah right ill bring my tape measure fri,ham,ham,0.055832416
im nt goin got somethin on unless they meetin dinner lor haha wonder who will go tis time,ham,ham,0.33424786
thx all will be well in few months,ham,ham,0.0056221713
all these nice new shirts and the only thing can wear them to is nudist themed you in mu,ham,ham,0.16903949
mmmmm loved waking to your words this morning miss you too my love hope your day goes well and you are happy wait for us to be together again,ham,ham,0.46711904
is xy in ur car when picking me up,ham,ham,0.017735079
dont look back at the building because you have no coat and dont want you to get more sick just hurry home and wear coat to the gym,ham,ham,0.26710233
you still at the game,ham,ham,0.0038670334
you are being ripped off get your mobile content from wwwclubmobycom call polytruepixringtonesgames six downloads for only,spam,smishing,0.50376403
if sending her home first its ok lor im not ready yet,ham,ham,0.03909133
ya im referin to meis ex wat no ah waitin to treat somebody shld rich liaoso gd den dun have to work frm tmr onwards,ham,smishing,0.72402364
beautiful tomorrow never comes when it comes its already today in the hunt of beautiful tomorrow dont waste your wonderful today goodmorning,ham,smishing,0.58605015
true it is passable and if you get high score and apply for phd you get years of salary so it makes life easier,ham,ham,0.19348696
we owe you for the last tax year please follow our secure link httpowlyozvotjxz for more information,smishing,ham,0.39615458
ssnervous ltgt,ham,ham,0.0006822385
here is your discount code rp to stop further messages reply stop wwwregalportfoliocouk customer services,smishing,smishing,0.82627636
it wont until as trying sort house out is that ok,ham,ham,0.06547219
wont touch you with out your permission,ham,ham,0.0052398457
ha ha cool cool chikku chikkudb,ham,ham,0.13823083
apart from the one told you about yesterday,ham,ham,0.011821606
lul im gettin some juicy gossip at the hospital two nurses are talking about how fat they are gettin and one thinks shes obese oyea,ham,smishing,0.76199704
hi ya babe goten bout me scammers getting smartthough this is regular vodafone no if you respond you get further prem rate msgsubscription other nos used also beware,spam,smishing,0.67571706
atm blockdear customer due to our system upgrade your atm card has just been deactivated to activate call customer care for help now,smishing,smishing,0.91003114
esplanade lor where else,ham,ham,0.0016524956
yeah in fact he just asked if we needed anything like an hour ago when and how much,ham,ham,0.1106904
to review and keep the fantastic nokia ngage game deck with club nokia go wwwcnupdatescomnewsletter unsubscribe from alerts reply with the word out,spam,smishing,0.70158607
hai dear friends this is my new amp present number by rajitha raj ranju,ham,ham,0.31416187
aight can you text me the address,ham,ham,0.0052418294
no probably ltgt,ham,ham,0.0018799005
free st week entry textpod chance win gb ipod or cash every wk txt vpod to tscs wwwtextpodnet custcare,smishing,smishing,0.8641713
collecting ur laptop then going to configure da settings izzit,ham,ham,0.011868992
for chance win gb ipod or cash every wk txt pod to tscs wwwtextpodnet custcare,spam,smishing,0.74587387
think you sent the text to the home phone that cant display texts if you still want to send it his number is,ham,ham,0.35232177
is it ok if stay the night here xavier has sleeping bag and im getting tired,ham,ham,0.06295542
rmo aeon my rs was charged on your card num at lazoklia on call if you did not perform this txn code,smishing,ham,0.29883912
good day to you toopray for meremove the teeth as its painful maintaining other stuff,ham,ham,0.28218466
shes good she was wondering if you wont say hi but shes smiling now so how are you coping with the long distance,ham,ham,0.23140687
do know what is real friendship,ham,ham,0.003318087
oor step service for passport assistancepan cardincome tax returnvat returnservice tax return contact ms ons jwala heri mkt paschim viha,spam,ham,0.31148615
thk of wat to eat tonight,ham,ham,0.0035805902
ha wouldnt say that just didnt read anything into way seemed dont like be judgementali save that for fridays in the pub,ham,ham,0.22631039
dont talk to him ever ok its my word,ham,ham,0.019830273
okie but scared say fat then dun wan me already,ham,ham,0.042464282
also that chat was awesome but dont make it regular unless you can see her in person,ham,ham,0.061077453
yo dude guess who just got arrested the other day,ham,ham,0.024777886
wat time liao where still got,ham,ham,0.012448745
lyricalladief is inviting you to be her friend reply yes or no see her wwwsmsacuhmmross stop send stop frnd to,spam,ham,0.47067538
superb thought be grateful that dont have everything want that means still have an opportunity to be happier tomorrow than are today,ham,ham,0.43487394
dear voucher holder claim your st class airport lounge passes when using your holiday voucher call when booking quote st class,smishing,smishing,0.91486025
hey they not watching movie tonight so ill prob home early,ham,ham,0.11866173
no sir thats why had an hr trip on the bus last week have another audition next wednesday but think might drive this time,ham,smishing,0.77421355
your free ringtone is waiting to be collected simply text the password mix to to verify get usher and britney,spam,ham,0.2893945
enjoy watching and playing football and basketball anything outdoors and you,ham,ham,0.18489401
pandy joined technologies todayhe got job,ham,ham,0.00065518223
we took hooch for walk toaday and fell over splat grazed my knees and everything should have stayed at home see you tomorrow,ham,ham,0.3952243
spook up your mob with halloween collection of logo pic message plus free eerie tone txt card spook to zed per logopic,spam,smishing,0.7912158
hi elaine is todays meeting confirmed,ham,ham,0.011236113
fuuuuck need to stop sleepin sup,ham,ham,0.022300644
get down in gandhipuram and walk to cross cut road right side ltgt street road and turn at first right,ham,ham,0.3916055
ello babe ok,ham,ham,0.0028637892
hi missed your call and my mumhas beendropping red wine all over theplace what is your adress,ham,ham,0.06478976
think if he rule tamilnaduthen its very tough for our people,ham,ham,0.02298433
how are you doing hope youve settled in for the new school have great day,ham,ham,0.11134939
hurt me tease me make me cry but in the end of my life when die plz keep one rose on my grave and say miss,ham,ham,0.20277604
on hen night going with swing,ham,ham,0.0045492398
thats cool ill come by like ltgt ish,ham,ham,0.00803495
aight see you in bit,ham,ham,0.0022067367
theoretically yeah he could be able to come,ham,ham,0.01750576
call him and say you not coming today ok and tell them not to fool me like this ok,ham,ham,0.1505428
ok how many should buy,ham,ham,0.0071082073
huh so slow tot reach long ago liao more days only more leh,ham,ham,0.49978647
what to think no one saying clearly ok leave no need to ask her will go if she come or not,ham,ham,0.31935567
nowadays people are notixiquating the laxinorficated opportunity for bambling of entropication have you ever oblisingately opted ur books for the masteriastering amplikater of fidalfication it is very champlaxigating think it is atrocious wotz ur opinion junna,ham,smishing,0.5448089
yes that will be fine love you be safe,ham,ham,0.011701896
