text,true_label,pred_label,pred_proba
its ok noe ure busy but im really too bored so msg oso dunno wat colour she choose me one,ham,smishing,0.58947736
boltblue tones for reply poly or mono eg poly cha cha slide yeah slow jamz toxic come with me or stop more tones txt more,spam,smishing,0.647659
thats the thing with apes can fight to the death to keep something but the minute they have it when let go thats it,ham,ham,0.2276533
you got called tool,ham,ham,0.001819524
stop calling everyone saying might have cancer my throat hurts to talk cant be answering everyones calls if get one more call im not babysitting on monday,ham,smishing,0.54407346
just really need shit before tomorrow and know you wont be awake before like,ham,ham,0.22199804
still painting ur wall,ham,ham,0.0014116996
apple id buxcxgbvwwccod final notification your apple is due to expire today prevent this by confirming your apple id athttpverifyappleuk apple inc,smishing,smishing,0.99023354
are you planning to come chennai,ham,ham,0.0029371225
im in class will holla later,ham,ham,0.004357245
lmao ok wont be needing to do my hair anymore,ham,ham,0.00943382
said its okay sorry,ham,ham,0.0014106869
apple has detected an unauthorized signin to your cloud account if this message goes without reply apple will be forced to suspend your account please verify this icloud device by sending your correct apple id and password via text message,smishing,smishing,0.698679
single line with big meaning miss anything ur best life but dont miss ur best life for anything,ham,smishing,0.50859964
goodo yes we must speak friday eggpotato ratio for tortilla needed,ham,ham,0.013556276
went to ur hon lab but no one is there,ham,ham,0.01378714
this is one of the days you have billion classes right,ham,ham,0.049173757
thank,ham,ham,0.08013852
err cud do im going to at pm havent got way to contact him until then,ham,ham,0.12163865
nova medical centers conducts shoulder pain clinic on mar thconsult our renowned shoulder specialists drmahesh reddy drjatty call,spam,smishing,0.9986143
hi the sexychat girls are waiting for you to text them text now for great night chatting send stop to stop this service,spam,smishing,0.50798106
there are many company tell me the language,ham,ham,0.012955775
sorry ill call laterbuzy,ham,ham,0.001698719
come search tat vidnot finishd,ham,ham,0.014700263
think just yourself thanks and see you tomo,ham,ham,0.0096764965
im gonna be home soon and dont want to talk about this stuff anymore tonight ileave this topic for now,ham,ham,0.47476062
call now just per min ntt ltd po box croydon cr wb is national rate call,spam,smishing,0.67163634
just got outta class gonna go gym,ham,ham,0.02607123
congratulations ore mo owo re wa enjoy it and wish you many happy moments to and fro wherever you go,ham,ham,0.30264792
yup ok thanx,ham,ham,0.0014410588
your brother is genius,ham,ham,0.0037202078
willing live local to you text reply to hear strt back from me per msg netcollex ltdhelpdesk reply stop to end,spam,smishing,0.6558797
joys father is john then john is the name of joys father mandan,ham,ham,0.14580414
spoke with uncle john today he strongly feels that you need to sacrifice to keep me here hes going to call you when he does beg you to just listen dont make any promises or make it clear things are not easy and need you to please let us work things out as long as keep expecting help my creativity will be stifled so pls just keep him happy no promises on your part,ham,ham,0.22871217
know im lacking on most of this particular dramastorms details but for the most part im not worried about that,ham,ham,0.2385331
we will hold your paytm amount after sometime complete your paytm kyc paytm office ph,smishing,smishing,0.9268452
someone know has asked our dating service contact you cant guess who call now all will be revealed po box wu,smishing,smishing,0.65839094
didnt you get hep immunisation in nigeria,ham,ham,0.004765558
how much is blackberry bold in nigeria,ham,ham,0.007858502
haha good to hear im officially paid and on the market for an th,ham,ham,0.037298284
private your account statement for shows unredeemed points call identifier code expires,smishing,smishing,0.93355614
dunno leh cant remember mayb lor so wat time we meeting tmr,ham,ham,0.09864113
is there reason weve not spoken this year anyways have great week and all the best in your exam,ham,ham,0.2414546
yeah ill try to scrounge something up,ham,ham,0.049293086
lol for real she told my dad have cancer,ham,ham,0.024823725
okthats fine,ham,ham,0.18801066
how is your schedule next week am out of town this weekend,ham,ham,0.05463468
uploaded mine to facebook,ham,ham,0.00061843864
nationwide has noticed your debit card was recently used on at apple online store for gbp if not you please urgently call fraud prevention on or int do not reply by sms httpwwwnationwidecouk,smishing,smishing,0.55997324
sorry ill call later at mins,ham,ham,0.009187766
hey girl how hope well me an del bak again long time no give me call sum time from lucyxx,ham,ham,0.42414126
is toshiba portege gd,ham,ham,0.024259014
hanks lotsly,ham,ham,0.021192892
derp which is worse dude who always wants to party or dude who files complaint about the three drug abusers he lives with,ham,smishing,0.5808866
same as kallis dismissial in nd test,ham,ham,0.010130594
had the money issue weigh me down but thanks to you can breathe easier now ill make sure you dont regret it thanks,ham,ham,0.3415384
dad says hurry the hell up,ham,ham,0.0075712013
were finally ready fyi,ham,ham,0.010343854
as valued customer am pleased to advise you that following recent review of your mob no you are awarded with bonus prize call,smishing,smishing,0.84119534
yes please leave at ltgt so that at ltgt we can leave,ham,ham,0.016496165
urgent your mobile number has been awarded with inr prize guaranteed call from land line claim valid hrs only,smishing,smishing,1.0
hot live fantasies call now just per min ntt ltd po box croydon cr wb,spam,smishing,0.9697882
need an th but im off campus atm could pick up in an hour or two,ham,ham,0.2704992
any chance you might have had with me evaporated as soon as you violated my privacy by stealing my phone number from your employers paperwork not cool at all please do not contact me again or will report you to your supervisor,ham,ham,0.284761
tomarrow want to got to court at ltdecimalgt so you come to bus stand at,ham,ham,0.07141391
some of them told accenture is not confirm is it true,ham,ham,0.0114870295
got lousy sleep kept waking up every hours to see if my cat wanted to come in worry about him when its cold,ham,ham,0.4042567
shall ask one thing if you dont mistake me,ham,ham,0.013966273
kdo it at evening daurgent,ham,ham,0.001852644
sms services for your inclusive text credits pls goto wwwcomuknet login qxj unsubscribe with stop no extra charge help comuk cm ae,spam,smishing,0.9864138
hii got the money da,ham,ham,0.0015316805
im hungry buy smth home,ham,ham,0.01258197
where did go my phone is gonna die you have to stay in here,ham,ham,0.045192048
can you plz tell me the ans bslvyl sent via fullonsmscom,ham,ham,0.44714528
yes watching footie but worried were going to blow it phil neville,ham,ham,0.0388887
how do friends help us in problems they give the most stupid suggestion that lands us into another problem and helps us forgt the previous problem,ham,smishing,0.56102127
no prob will send to your email,ham,ham,0.0108775515
kkfrom tomorrow onwards started ah,ham,ham,0.0050111827
then drive lor,ham,ham,0.0013990805
nobut heard abt tat,ham,ham,0.20665333
sure but make sure he knows we aint smokin yet,ham,ham,0.08021279
aight let me know when youre gonna be around usf,ham,ham,0.035603292
are you still playing with gautham,ham,ham,0.008236608
hav almost reached call unable to connect,ham,ham,0.15551299
umma did she say anything,ham,ham,0.0023049903
alrite sam its nic just checkin that this is ur numberso is ittb,ham,ham,0.032274175
oh only outside players allowed to play know,ham,ham,0.016035413
dear customer your paytmkyc has been expired its will be blcked within hour please contact customer care ph immediately to verify,smishing,smishing,0.8345361
no dice art class thru thanks though any idea what time should come tomorrow,ham,ham,0.351034
text get more ringtones logos and games from wwwtxtcom questions infotxtcouk,spam,ham,0.3881997
jason says hes gonna be around so ill be up there around ltgt,ham,ham,0.038865376
babe how goes that day what are you doing where are you sip my cappuccino and think of you my love send kiss to you from across the sea,ham,ham,0.37104657
even my brother is not like to speak with me they treat me like aids patent,ham,ham,0.048534147
freemsg fancy flirt reply date now join the uks fastest growing mobile dating service msgs rcvd just to optout txt stop to reply date now,spam,smishing,0.870478
what im saying is if you havent explicitly told nora know someone im probably just not gonna bother,ham,ham,0.30747068
ill hand her my phone to chat wit,ham,ham,0.009272278
er yep sure props,ham,ham,0.021628255
got itmail panren paru,ham,ham,0.015941517
thanx today cer it was nice catch up but we ave find more time more often oh well take care soonc,ham,smishing,0.52322704
wake up already wat doing picking us up later rite im taking sq reaching ard smth like dat can check arrival time ya soon,ham,ham,0.3399394
hi the way was with day is the normal waythis is the real me ur uniquei hope know the rest of mylife hope find wot was lost,ham,ham,0.4808093
ive been searching for the right words to thank you for this breather promise wont take your help for granted and will fulfil my promise you have been wonderful and blessing at all times,ham,ham,0.2992661
this message is free welcome to the new improved sex dogging club to unsubscribe from this service reply stop msgsp only,spam,smishing,0.7495079
can help swoop by picking up from wherever ur other birds meeting if want,ham,ham,0.14892983
gud mrng dear hav nice day,ham,ham,0.061599255
sorry flaked last night shits seriously goin down with my roommate what you up to tonight,ham,smishing,0.5272585
im in office now dawhere are you,ham,ham,0.018366337
that sucks ill go over so can do my hair youll do it free right,ham,ham,0.046913244
xclusiveclubsaisai morow soiree speciale zouk with nichols from parisfree roses all ladies info,smishing,ham,0.21844979
local covid study compensation up to qualify herecashstudycom,smishing,ham,0.0050194347
great so what attracts you to the brothas,ham,ham,0.0037069342
are you the cutest girl in the world or what,ham,ham,0.016542181
can you use foreign stamps for whatever you send them off for,ham,ham,0.10426484
hope you arnt pissed off but id would really like to see you tomorrow love me xxxxxxxxxxxxxx,ham,ham,0.27195042
ok anyway no need to change with what you said,ham,ham,0.019177016
with my sis lor we juz watched italian job,ham,ham,0.4404622
mah ill pick it up tomorrow,ham,ham,0.005008024
hey darlin can pick up at college if tell me wen where mt love pete xx,ham,ham,0.26585585
enjoy the jamster videosound gold club with your credits for new videosounds logosmusicnews get more fun from jamstercouk only help call,spam,smishing,0.599013
no rushing im not working im in school so if we rush we go hungry,ham,ham,0.022604968
still working now,ham,ham,0.0019282914
atm blockdear customer due to our system upgrade your atm card has just been deactivated to reactivate call customer care for help now,smishing,smishing,0.9105941
this phone has the weirdest auto correct,ham,ham,0.040725335
wonder if your phone battery went dead had to tell you love you babe,ham,ham,0.09183804
what mean almost done done wif sleeping but tot going to take nap yup send her liao so im picking her up at ard smth lor,ham,smishing,0.61075413
ok but bag again,ham,ham,0.0014229362
and you will expect you whenever you text hope all goes well tomo,ham,ham,0.07768466
so gonna get deus ex,ham,ham,0.0050703217
short but cute be good person but dont try to prove it good morning,ham,ham,0.021593088
orange customer you may now claim your free camera phone upgrade for your loyalty call now on offer ends thmarch tcs apply optout availa,smishing,smishing,0.8761073
free entry in wkly comp to win fa cup final tkts st may text fa to to receive entry questionstd txt ratetcs apply overs,spam,smishing,0.84740466
im done oredi,ham,ham,0.0013246217
you said to me before went back to bed that you cant sleep for anything,ham,ham,0.117152326
have secret admirer who is looking make contact with ufind out who they rreveal who thinks ur so specialcall on,smishing,ham,0.33053035
sms ac blind date rodds is from aberdeen united kingdom check him out httpimg sms acwicmbcktzr no blind dates send hide,smishing,smishing,0.8911487
wait will msg after ltgt min,ham,ham,0.005603956
ffffffffff alright no way can meet up with you sooner,ham,ham,0.012054262
how are you my love are you with your brother time to talk english with him grins say hey muhommad penny says hello from across the sea,ham,smishing,0.97124547
thats significant but dont worry,ham,ham,0.0019773836
is she replying has boye changed his phone number,ham,ham,0.26717672
how noe shes in da car now later then lar im wearing shorts,ham,ham,0.11267463
near kalainar tv officethenampet,ham,ham,0.1398285
storming msg wen lift phne say hello do knw wt is real meaning of hello its name of girl yes and knw who is dat girl margaret hello she is girlfrnd grahmbell who invnted telphone,ham,smishing,0.69761574
sms services for your inclusive text credits pls goto wwwcomuknet login unsubscribe with stop no extra charge help po box ip we,spam,smishing,0.96337986
hey what happen de are you alright,ham,ham,0.016023101
you have been specially selected to receive pound award call before the lines close cost ppm tcs apply ag promo,smishing,smishing,0.9642895
aiyo so poor thing then dun wan eat bathe already,ham,ham,0.13592795
wat time do wan meet me later,ham,ham,0.01554356
id have to check but theres only like bowls worth left,ham,ham,0.23688838
yep the great loxahatchee xmas tree burning of ltgt starts in an hour,ham,ham,0.07393418
sms auction brand new nokia is up auction today auction is free join take part txt nokia to now hgsuitelands rowwjhl,spam,smishing,0.6901618
not free today haf pick my parents up tonite,ham,ham,0.026111031
if youre thinking of lifting me one then no,ham,ham,0.013860317
this is wishing you great day moji told me about your offer and as always was speechless you offer so easily to go to great lengths on my behalf and its stunning my exam is next friday after that will keep in touch more sorry,ham,ham,0.38295066
oh was thkin of goin yogasana at den no nd to go at den can rush to parco nb okie lor call me when ready,ham,smishing,0.54755205
machan you go to gym tomorrow wil come late goodnight,ham,ham,0.120209455
hey ive booked the lessons on sun liao,ham,ham,0.017973237
aight lemme know whats up,ham,ham,0.009013913
oh icic lor den meet other day,ham,ham,0.01676519
january male sale hot gay chat now cheaper call national rate from pmin cheap to pmin peak to stop texts call pmin,spam,smishing,0.9192923
dont run away frm walk slowly amp it kills me that dont care enough to stop me,ham,ham,0.45886272
did you see that film,ham,ham,0.003942771
subscribe to weekly ringtoneget st week freesend subpoly to per weekstop sms,spam,ham,0.31123003
whats up bruv hope you had great break do have rewarding semester,ham,ham,0.06385196
excellent wish we were together right now,ham,ham,0.018669091
just dropped em off omw back now,ham,ham,0.15479633
sorry about that this is my mates phone and didnt write it love kate,ham,ham,0.042750657
thats shame maybe cld meet for few hrs tomo,ham,ham,0.13283199
dear sirsalam alaikkumpride and pleasure meeting you today at the tea shopwe are pleased to send you our contact number at qatarrakhesh an indianpls save our numberrespectful regards,ham,smishing,0.76490253
when login dat time dad fetching home now,ham,ham,0.3100159
friendship poem dear dear not near but can hear dont get fear live with cheer no more tear always my dear gud ni,ham,ham,0.35768756
im working technical support voice process,ham,ham,0.29698515
oh god am happy to see your message after days,ham,ham,0.07009147
yeah so basically any time next week you can get away from your mom amp get up before,ham,ham,0.18711308
mths half price orange line rental latest camera phones free had your phone mths call mobilesdirect free on to update now orstoptxt,spam,smishing,0.85846573
very strange and are watching the nd one now but im in bed sweet dreams miss,ham,ham,0.16070056
lol they were mad at first but then they woke up and gave in,ham,ham,0.031482685
jay told me already will do,ham,ham,0.005431851
no on the way home so if not for the long dry spell the season would have been over,ham,ham,0.1425869
sorry da thangamits my mistake,ham,ham,0.0056766975
what time you coming down later,ham,ham,0.0071282224
im home,ham,ham,0.0009704835
ok ill do you right later,ham,ham,0.0034696963
aldrine rakhesh ex rtm herepls callurgent,ham,ham,0.0019169973
theres someone here that has year ltgt toyota camry like mr olayiwolas own mileage is ltgt kits clean but need to know how much will it sell for if can raise the dough for it how soon after landing will it sell holla back,ham,ham,0.4601228
have you heard about that job im going to that wildlife talk again tonight if wantcome its thatworzels and wizzle or whatever it is,ham,ham,0.3909261
have your lunch and come quickly and open the door,ham,ham,0.017771175
today is accept dayu accept me as,ham,ham,0.016996166
have to take exam with march,ham,ham,0.012534605
yup song bro no creative neva test quality he said check review online,ham,ham,0.39425215
they will pick up and drop in carso no problem,ham,ham,0.020904556
wan to go there doctor,ham,ham,0.0044330684
left dessert wan me go suntec look,ham,ham,0.007156264
oh is it send me the address,ham,ham,0.0069145537
what time wrkin,ham,ham,0.0014633614
hi my engagement has been fixd on ltgt th of next month know its really shocking bthmm njan vilikkamt ws al of sudn,ham,smishing,0.95777255
ya had just nowonion roast,ham,ham,0.008491379
yeshe is really greatbhaji told kallis best cricketer after sachin in worldvery tough to get out,ham,ham,0.3073669
reat deals at the mobilestore get rs off on mobile purchases above rs rush offer valid till st feb show mcoupon rpd,spam,smishing,0.9930016
cthen thk shd enuff still got conclusion contents pg references ill doing da contents pg cover pg,ham,ham,0.42617765
eh remember how spell his name yes did he have been naughty until have met him,ham,ham,0.34791985
welcome please reply with your age and gender to begin eg,spam,ham,0.039012488
sorry sir will call you tomorrow senthilhsbc,ham,ham,0.015557422
this is all just creepy and crazy to me,ham,ham,0.011834699
hi finally completed the course,ham,ham,0.0023552768
sorry not now,ham,ham,0.0013735148
urgent your costa del sol holiday or await collection call now toclaim sae tc pobox stockport skxh costpm maxmins,smishing,smishing,0.99307066
hey dont forget you are mine for me my possession my property mmm childish smile,ham,ham,0.27920407
oh kkwhere did you take test,ham,ham,0.0050379466
no its truekdo knw dis no ltgt,ham,ham,0.030011104
im really sorry wont able do this fridayhope can find an alternativehope yr terms going ok,ham,smishing,0.6587072
bognor it is should be splendid at this time of year,ham,ham,0.008194836
you have won nokia this is what you get when you win our free auction to take part send nokia to now hgsuitelands rowwjhl,smishing,smishing,0.6203293
after completed degree there is no use in joining finance,ham,ham,0.0085088005
yeah you should think you can use your gt atm now to register not sure but if theres anyway can help let me know but when you do be sure you are ready,ham,ham,0.42398632
yeah dont see why not,ham,ham,0.005976309
your opinion about me oversmart selfish naughy lovable silent special immature stylish simple pls reply,ham,ham,0.12627494
am not working but am up to eyes in philosophy so will text later when bit more free for chat,ham,ham,0.2683496
can not,ham,ham,0.0010001471
sorry ill call later ok bye,ham,ham,0.016454704
good good job like entrepreneurs,ham,ham,0.0060394965
know you are serving mean what are you doing now,ham,ham,0.0137364585
sorry me going home first daddy come fetch later,ham,ham,0.08513588
no no will check all rooms befor activitiesthats required,ham,ham,0.17556193
sorry my battery died can come by but im only getting gram for now wheres your place,ham,ham,0.27148944
sorry dont knw,ham,ham,0.0013867795
wat time wan today,ham,ham,0.0015496402
send his number and give reply tomorrow morning for why you said that to him like that ok,ham,ham,0.20469502
loa homeowners tenants welcome have you been previously refused we can still help call free or text back help,smishing,ham,0.46736464
finished my lunch already wake up already,ham,ham,0.024845818
wanna get laid nite want real dogging locations sent direct to ur mobile join the uks largest dogging network txt park to now nyt eca lp msg,spam,smishing,0.9424337
dhoni have luck to win some big titleso we will win,ham,ham,0.029625885
ok both our days so what are you making for dinner tonite am invited,ham,ham,0.30643806
feel like dick because keep sleeping through your texts and facebook messages sup you in town,ham,ham,0.24296461
my mobile numberpls sms ur mail idconvey regards to achanammarakheshqatar,ham,ham,0.0401731
full heat pa have applyed oil pa,ham,ham,0.08486152
you ve won your costa del sol holiday or await collection call now toclaim sae tc pobox stockport skxh costpm maxmins,smishing,smishing,0.99244845
sounds like you have many talents would you like to go on dinner date next week,ham,ham,0.38866252
his bday real is in april,ham,ham,0.006959649
hello my love how goes that day wish your well and fine babe and hope that you find some job prospects miss you boytoy teasing kiss,ham,smishing,0.5555063
me not waking up until in the afternoon sup,ham,ham,0.012885254
fantasy football is back on your tv go to sky gamestar on sky active and play dream team register nowsky opt out to,spam,smishing,0.5865834
except theres chick with huge boobs,ham,ham,0.009579786
youhv completed transaction for aud on pm please follow the link if it is not done by you httpcommbanknetban,smishing,ham,0.1266018
you should change your fb to jaykwon thuglyfe falconerf,ham,ham,0.27858815
oktake careumma to you too,ham,ham,0.00084838865
ujhhhhhhh computer shipped out with address to sandiago and parantella lane wtf poop,ham,ham,0.30019
rediscover the deeper meaning of life and the means to attain true peace understand the essence of being true sikh sms join gurubani to,spam,smishing,0.80148107
there is no sense in my foot and penis,ham,ham,0.008552547
hmmbad newshype park plaza studio takenonly left bedrm,ham,ham,0.0013377704
as valued customer am pleased to advise you that following recent review of your mob no you are awarded with bonus prize call,smishing,smishing,0.84119534
hi you just spoke to maneesha if you were satisfied with the experience reply with yes else no,ham,ham,0.30609408
text me when youre on the way,ham,ham,0.009433923
you didnt hear it from me,ham,ham,0.010054347
what is important is that you prevent dehydration by giving her enough fluids,ham,ham,0.08659385
double mins double txt price call mobileupd for the very latest offers or calloptoutlf,spam,smishing,0.5790558
christmas is an occasion that is celebrated as reflection of ur values desires affectionsamp traditions have an ideal christmas,ham,ham,0.24835478
play computer aiyah tok lor,ham,ham,0.13895921
well at this right im gonna have to get up and check todays steam salespee so text me when you want me to come get you,ham,ham,0.32204926
think ive fixed it can you send test message,ham,ham,0.014083979
famous quote when you develop the ability to listen to anything unconditionally without losing your temper or self confidence it means you are married,ham,smishing,0.5296594
all sounds good fingers makes it difficult to type,ham,ham,0.02798576
please complete registration process before using any service code tid,spam,ham,0.4911956
hui xin is in da lib,ham,ham,0.0026522847
do you want new video phone anytime any network mins text for only five pounds per week call now or reply for delivery tomorrow,smishing,smishing,0.689592
reminder you have not downloaded the content you have already paid for goto httpdoit mymoby tv to collect your content,smishing,ham,0.4157084
dont quite know what to do still cant get hold of anyone cud pick you up bout pm and we can see if theyre in the pub,ham,ham,0.25574437
good morning im suffering from fever and dysentry will not be able to come to office today,ham,ham,0.1922866
hi baby im cruisin with my girl friend what up give me call in and hour at home if thats alright or fone me on this fone now love jenny xxx,ham,smishing,0.5235189
all well,ham,ham,0.0010085208
ok will message before leave my house,ham,ham,0.016315881
no nokia tone ur mob every week just txt nokia to get txting and tell ur mates wwwgetzedcouk pobox wwq normptone,spam,smishing,0.9507679
hmmm thought we said hours slave not you are late how should punish you,ham,ham,0.20476653
im going out to buy mums present ar,ham,ham,0.058456887
cant pick the phone right now will call later,ham,ham,0.041494653
dude we should go sup again,ham,ham,0.0042537204
dear am not denying your words please,ham,ham,0.011184795
but really quite funny lor wat then shd haf run shorter distance wat,ham,smishing,0.8705525
how much did ur hdd casing cost,ham,ham,0.03034164
send this to ur friends and receive something about ur voice how is my speaking expression childish naughty sentiment rowdy ful of attitude romantic shy attractive funny ltgt irritating ltgt lovable reply me,ham,smishing,0.5589334
celebrate my bday else,ham,ham,0.0012321402
