text,true_label,pred_label,pred_proba
im going lunch now wif my family then aft dat go str orchard lor,ham,ham,0.42119792
send to someone else,ham,ham,0.0015553677
pathaya enketa maraikara pa,ham,ham,0.0008060257
also sir sent you an email about how to log into the usc payment portal ill send you another message that should explain how things are back home have great weekend,ham,smishing,0.5810622
so what doing today,ham,ham,0.0019000418
please attend the phone,ham,ham,0.0048828768
if you still havent collected the dough pls let me know so can go to the place sent it to get the control number,ham,ham,0.24188805
hmmm mayb can try shoppin area one but forgot name of hotel,ham,ham,0.070905425
should tell my friend not to come round til like ltgt ish,ham,ham,0.02787069
urgent call from landline your complimentary tenerife holiday or cash await collection sae tcs box hp yf ppm,smishing,smishing,0.9658483
did you show him and wot did he say or could not him dust,ham,ham,0.104385056
almost there see in sec,ham,ham,0.0022849664
good afternoon sunshine how dawns that day are we refreshed and happy to be alive do we breathe in the air and smile think of you my love as always,ham,ham,0.28536513
where we meeting,ham,ham,0.0013459437
thanks for looking out for me really appreciate,ham,ham,0.008412695
when you guys planning on coming over,ham,ham,0.015285885
course it yrs just so her messages on messenger lik you sending me,ham,ham,0.098029636
todays vodafone numbers ending with my last four digits are selected to received award if your number matches please call to claim your award,smishing,smishing,0.80285007
tot reach liao he said tshirt,ham,ham,0.013399322
youd like that wouldnt you jerk,ham,ham,0.005585609
no one interested may be some business plan,ham,ham,0.013477002
id like to tell you my deepest darkest fantasies call me just pmin to stop texts call nat rate,spam,smishing,0.8110053
my love hope your not doing anything drastic dont you dare sell your pc or your phone,ham,ham,0.21697919
im guy browsin is compulsory,ham,ham,0.016433928
will do was exhausted on train this morning too much wine and pie you sleep well too,ham,ham,0.14949511
on ma way to school can you pls send me ashleys number,ham,ham,0.07686164
later guess needa do mcat study too,ham,ham,0.019992728
free entry to the grprizes wkly comp chance to win the latest nokia psp or cash every wktxt great to httpwwwgrprizescom,smishing,smishing,0.57459533
ok thats cool its just off either raglan rd or edward rd behind the cricket ground gimme ring when ur closeby see you tuesday,ham,ham,0.27444258
whenwhere do pick you up,ham,ham,0.0021333424
that means you got an in epi shes fine shes here now,ham,ham,0.14523411
you have an outstanding tax refund of gp for the tax year please fill out the following form to process your refund httphmrctaxrebatecouk,smishing,smishing,0.5497328
good morning my dear have great dayenjoy,ham,ham,0.008211972
fine do you remember me,ham,ham,0.0043880325
in mca but not conform,ham,ham,0.0020400924
is ur paper in morn or aft tmr,ham,ham,0.011217656
yes da any plm at ur office,ham,ham,0.008040798
she went to attend another two rounds todaybut still didt reach home,ham,smishing,0.6397814
what do want for xmas how about free text messages new video phone with half price line rental call free now on to find out more,smishing,smishing,0.59178364
whats your room number again wanna make sure im knocking on the right door,ham,ham,0.084515
do you like shaking your booty on the dance floor,ham,ham,0.010245942
what time is ur flight tmr,ham,ham,0.0032426096
in which place can get rooms cheap,ham,ham,0.014208085
we tried to contact you re your reply to our offer of mins textand new video phone call now or reply for free delivery tomorrow,smishing,smishing,0.719127
yo call me when you get the chance friend of mine wanted me to ask you about big order,ham,ham,0.31021294
thanks for the vote now sing along with the stars with karaoke on your mobile for free link just reply with sing now,spam,smishing,0.5602969
do you know when the result,ham,ham,0.0029135647
hows it feel mr your not my real valentine just my yo valentine even tho hardly play,ham,smishing,0.89053774
yeah whatever lol,ham,ham,0.005683058
you gonna ring this weekend or wot,ham,ham,0.03736599
can win of music gift vouchers every week starting now txt the word draw to tscs wwwidewcom skillgame winaweek age ppermesssubscription,spam,ham,0.41712052
hes just gonna worry for nothing and he wont give you money its no use,ham,ham,0.22659586
change windows logoff sound,ham,ham,0.0070914743
oh kbut he is not big hitteranyway good,ham,ham,0.009680268
anything lor juz both of us lor,ham,ham,0.03732706
so you think should actually talk to him not call his boss in the morning went to this place last year and he told me where could go and get my car fixed cheaper he kept telling me today how much he hoped would come back in how he always regretted not getting my number etc,ham,ham,0.2641734
so many people seems to be special at first sight but only very few will remain special to you till your last sight maintain them till life ends virat,ham,smishing,0.89896816
havent planning to buy later check already lido only got show in afternoon finish work already,ham,ham,0.38081583
had your mobile mths you are entitled to update to the latest colour camera mobile for free call the mobile update co free on,smishing,smishing,0.9501548
just sleepingand surfingenjoying free time,ham,ham,0.03855882
watch lor saw few swatch one thk quite ok ard but need nd opinion leh,ham,ham,0.40345168
wow never realized that you were so embarassed by your accomodations thought you liked it since was doing the best could and you always seemed so happy about the cave im sorry didnt and dont have more to give im sorry offered im sorry your room was so embarassing,ham,ham,0.36853758
what are you doing in langport sorry but ill probably be in bed by pm it sucks being ill at xmas when do you and gosri lanka,ham,ham,0.23934269
can you let me know details of fri when find out cos im not in tom or fri mentionned chinese thanks,ham,smishing,0.6573978
ok so april cant wait,ham,ham,0.008538907
itll be tough but ill do what have to,ham,ham,0.0065080086
what part of dont initiate dont you understand,ham,ham,0.005703265
good luck draw takes place th feb good luck for removal send stop to customer services,smishing,smishing,0.57207453
but its not common car here so its better to buy from china or asia or if find it less expensive ill holla,ham,smishing,0.6603268
sorry to trouble again can buy for my dad again all big small sat sun thanx,ham,smishing,0.7618772
nah cant help you there ive never had an iphone,ham,ham,0.0647875
dont make life too stressfull always find time to laugh it may not add years to your life but surely adds more life to ur years gud niswt dreams,ham,smishing,0.67377263
sorry will be able to get to you see you in the morning,ham,ham,0.02355747
oh ic thought you meant mary jane,ham,ham,0.03201258
yes posted couple of pics on fb theres still snow outside too im just waking up,ham,ham,0.2971651
know few people can hit up and hit to the yes,ham,ham,0.02610052
okbeautiful,ham,ham,0.08013852
urgent please call from landline cash or holiday await collection cs sae po box mxy,smishing,smishing,0.9629734
hows ur paper,ham,ham,0.0012866044
bring tat cd don forget,ham,ham,0.12562446
hi darlin how was work did get into trouble ijust talked to your mum all morning had really good time last night im goin out soon but call me if can,ham,ham,0.47740233
he said that he had right giggle when he saw again you would possibly be the first persondie from nvq but think how much you could for,ham,ham,0.39432314
dunno lei thk mum lazy to go out neva ask her yet,ham,ham,0.22828987
hey do fancy meetin me at at cha hav lil beverage on me if not txt or ring me and we can meet up lr quite tired got in at vpist love pete,ham,ham,0.32501695
urgent we are trying to contact todays draw shows that you have won prize guaranteed call from land line claim validhrs only,smishing,smishing,0.99907506
sorry about earlier putting out firesare you around to talk after or do you actually have life lol,ham,ham,0.25430804
im in movie collect car oredi,ham,ham,0.021633098
not yet chikkugoing to room nw im in bus,ham,ham,0.03159423
dear paytmcustomer your paytm kyc has been suspended paytm office ph your paytm ac will block within hr thank you,smishing,smishing,0.97418445
would really appreciate if you call me just need someone to talk to,ham,ham,0.07331733
usf guess might as well take car,ham,ham,0.022839632
free messagethanks for using the auction subscription service pmsgrcvd skip an auction txt out unsubscribe txt stop customercare,smishing,smishing,0.68960106
good stuff will do,ham,ham,0.0022311946
mobile office mms settings have been successfully delivered on your phone now you can access airtel live by long pressing key on nokia on other phones launch internet browser and select airtel live or goto httpliveairtelworldcom you pay no activation rental or browsing charges for airtel live you only pay if you download content or send mms,spam,smishing,0.729944
plan sanction as per mpd xtra floor xtra area dda mcd dsidc hudagurgaon faridabad noida hitech architects hitechincom,spam,ham,0.14181778
do well all will for little time thing of good times ahead,ham,ham,0.03415709
am literally in bed and have been up for like ltgt hours,ham,ham,0.019852882
do need login or anything,ham,ham,0.007985089
tick tick tick babe,ham,ham,0.117529
auntie huai juan never pick up her phone,ham,ham,0.010531645
cute thought for friendship its not necessary to share every secret with ur close frnd but watever shared should be true,ham,ham,0.34425417
we can go normal pilates after our intro,ham,ham,0.024150018
hows the street where the end of library walk is,ham,ham,0.07546696
do you want new video handset any time any network mins unlimited text camcorder reply or call now for del sat am,smishing,smishing,0.802719
as valued customer am pleased to advise you that following recent review of your mob no you are awarded with bonus prize call,smishing,smishing,0.84119534
how are you its been ages hows abj,ham,ham,0.025148978
dude just saw parked car with its sunroof popped up sux,ham,ham,0.21071547
urgent call from landline your complementary tenerife holiday or cash await collection sae tcs po box wa px ppm sender hol offer,smishing,smishing,0.91154146
gr poly tones all mobs direct rply with poly title to eg poly breathe titles crazyin sleepingwith finest ymca getzedcouk poboxowwq,spam,ham,0.13570039
sorry ill came to ur place later,ham,ham,0.013425821
hi darlin finish at do pick me up or meet me text back on this number luv kate xxx,ham,smishing,0.5325462
no plans yet what are you doing,ham,ham,0.011349467
fyi im gonna call you sporadically starting at like ltgt bc we are not not doin this shit,ham,ham,0.20057364
havent lost me ill always here ui didnt intend hurt but never knew how felt about me when iwasmarinethats what itriedtell urmomi careabout,ham,smishing,0.97058165
good no swimsuit allowed,ham,ham,0.0018486634
babe how goes that day what are you up to miss you already my love loving kiss hope everything goes well,ham,smishing,0.8144922
what can do might accidant tookplace between somewhere ghodbandar rd traffic moves slovely so plz slip amp dont worry,ham,ham,0.443932
and whenever you and see we can still hook up too,ham,ham,0.032028943
then mums repent how,ham,ham,0.011920211
havent left yet so probably gonna be here til dinner,ham,ham,0.074495554
dear voucher holder have your next meal on us use the following link on your pc enjoy dining experiencehttpwwwvouchmecometlpdiningasp,smishing,ham,0.4420588
yo carlos few friends are already asking me about you you working at all this weekend,ham,ham,0.18696477
actually just do whatever do find an excuse to be in tampa at some point before january though,ham,ham,0.3619658
dun wan to watch infernal affair,ham,ham,0.0206242
imagine life without me see how fast are searching medont worry lm always there to disturb goodnoon,ham,ham,0.30504298
cant dont have her number,ham,ham,0.004636194
please call amanda with regard to renewing or upgrading your current tmobile handset free of charge offer ends today tel subject to ts and cs,smishing,smishing,0.6289135
sorry vikky im watching olave mandara movie kano in trishul theatre wit my frnds,ham,ham,0.094066404
summers finally here fancy chat or flirt with sexy singles in yr area to get matched up just reply summer now free join optout txt stop help,spam,smishing,0.8437266
huh but cant go ur house empty handed right,ham,ham,0.07042397
alright omw gotta change my order to halfth,ham,ham,0.011563004
sir am waiting for your mail,ham,ham,0.0064891702
dont forget you can place as many free requests with stchoicecouk as you wish for more information call,smishing,ham,0.2835741
see you then were all christmassy here,ham,ham,0.007875526
guess it is useless calling something important,ham,ham,0.014391099
im meeting darren,ham,ham,0.0013062715
todays voda numbers ending with are selected to receive reward if you have match please call quoting claim code standard rates apply,smishing,smishing,0.99298507
yup ok,ham,ham,0.008351745
can that happen tonight,ham,ham,0.0016658843
free tarot texts find out about your love life now try for free text chance to only after free msgs each,spam,smishing,0.8117928
ya srsly better than yi tho,ham,ham,0.016070543
hurry home big butt hang up on your last caller if have to food is done and im starving dont ask what cooked,ham,ham,0.24090736
thats fine have him give me call if he knows what he wants or has any questions,ham,ham,0.31163916
who talking about,ham,ham,0.0021235633
have printed it oh so ltgt come upstairs,ham,ham,0.0074186116
hi chachi tried calling now unable to reach pl give me missed cal once tiz msg kanagu,ham,smishing,0.9746108
whats up do you want me to come online,ham,ham,0.008995366
you are chosen to receive award pls call claim number to collect your award which you are selected to receive as valued mobile customer,smishing,smishing,0.8187589
must book not huh so going for yoga basic on sunday,ham,ham,0.059644964
ill get there tomorrow and send it to you,ham,ham,0.0139348535
wake me up at ltgt am morning,ham,ham,0.00466817
tomarrow final hearing on my laptop case so cant,ham,ham,0.031875394
was about to do it when texted finished long time ago and showered and erything,ham,ham,0.115322724
well im going to be an aunty,ham,ham,0.006817959
cause im not freaky lol,ham,ham,0.0029693209
private your account statement for xxxxxx shows unredeemed points call identifier code expires,smishing,smishing,0.96228117
have won of gift vouchers week starting now call now,smishing,ham,0.27704498
cant pick the phone right now pls send message if anything urgent,ham,ham,0.157366
email alertfrom jeri stewartsize kbsubject lowcost prescripiton drvgsto listen to email call,spam,ham,0.00085589127
we tried to contact you re your reply to our offer of video handset anytime any networks mi reply or call now,smishing,smishing,0.64475065
okiegood news,ham,ham,0.20491222
are you not around or just still asleep,ham,ham,0.012531461
fyi im back in my parents place in south tampa so might need to do the deal somewhere else,ham,ham,0.23028547
oh kafter that placement there ah,ham,ham,0.0053146165
ugh cant just apologize admit were wrong and ask me to take back,ham,ham,0.039347783
check wid corect speling ie sarcasm,ham,ham,0.0101559
reply to win weekly what professional sport does tiger woods play send stop to to end service,spam,ham,0.395777
call now just per min ntt ltd po box croydon cr wb,spam,smishing,0.9078265
double mins txts on orange tariffs latest motorola sonyericsson nokia with bluetooth free call mobileupd on or calloptouthf,spam,smishing,0.72294885
they released vday shirts and when put it on it makes your bottom half naked instead of those white underwear,ham,smishing,0.5224563
have to take exam with in march,ham,ham,0.005206959
welcome to select an service with added benefits you can now call our specially trained advisors free from your mobile by dialling,spam,ham,0.49530768
shes fine good to hear from you how are you my dear happy new year oh,ham,ham,0.21422805
mon okie lor haha best is cheap gd food la ex oso okie depends on whether wana eat western or chinese food den which prefer,ham,smishing,0.93867624
youve already got flaky parent itsnot supposed to be the childs job to support the parentnot until theyre the ride age anyway im supposed to be there to support you and now ive hurt you unintentional but hurt nonetheless,ham,ham,0.44011685
otherwise had part time job and tuitionnow its difficult,ham,ham,0.03254742
no thursday,ham,ham,0.0011341464
quite ok but bit ex better go eat smth now else ill feel guilty,ham,ham,0.3020173
know grumpy old people my mom was like you better not be lying then again am always the one to play jokes,ham,ham,0.28176346
nothing meant that once the money enters your account here the bank will remove its flat rate someone transfered ltgt to my account and ltgt dollars got removed so the banks differ and charges also differbe sure you trust the ja person you are sending account details to cos,ham,smishing,0.64820814
was the actual exam harder than nbme,ham,ham,0.007986566
it is not possible,ham,ham,0.001498152
youre right have now that think about it,ham,ham,0.009443803
lol oh you got friend for the dog,ham,ham,0.010877109
were done,ham,ham,0.0018246078
hate when she does this she turns what should be fun day into an annoying day of quarrels,ham,ham,0.16701888
httptms widelivecomindex wmlidadafirsttruec ringtone,smishing,ham,0.13346353
what time you think youll have it need to know when should be near campus,ham,ham,0.06912081
ok din get ur msg,ham,ham,0.0025268255
got like ltgt can get some more later though get whatever you feel like,ham,ham,0.082978755
but im on diet and ate too many slices of pizza yesterday ugh im always on diet,ham,ham,0.19823228
symptoms when are in love like listening songs get stopped where see the name of your beloved wont get angry when your,ham,ham,0.33411655
swt thought nver get tired of doing little things lovable persons cozsomtimes those little things occupy biggest part in their hearts gud ni,ham,smishing,0.685407
win we have winner mr tilo won an ipod more exciting prizes soon so keep an eye on ur mobile or visit wwwwincouk,smishing,smishing,0.64175403
omg want to scream weighed myself and lost more weight woohoo,ham,ham,0.11653142
hey gals anyone of going down to driving centre tmr,ham,ham,0.15660234
natalie is inviting you to be her friend reply yes or no see her wwwsmsacunataliek,smishing,ham,0.12012139
this is the nd time we have tried to contact have won the prize claim is easy just call now only per minute btnationalrate,smishing,smishing,0.7043331
wait chikkuil send aftr ltgt mins,ham,ham,0.007812447
the oz guy is being kinda flaky but one friend is interested in picking up ltgt worth tonight if possible,ham,ham,0.29936883
dont let studying stress you out lr,ham,ham,0.010276484
ok thats great thanx lot,ham,ham,0.009030499
wow love you sooo much you know can barely stand it wonder how your day goes and if you are well my love think of you and miss you,ham,ham,0.21566747
good morning plz call me siri want to talk to usomething urgent,ham,ham,0.081886634
sorry dai was thought of calling you lot of timeslil busyi will call you at noon,ham,ham,0.12368807
dont think you need yellow card for uk travel ask someone that has gone before if you do its just ltgt bucks,ham,ham,0.36483333
hi chikku send some nice msgs,ham,ham,0.021435488
take some small dose tablet for fever,ham,ham,0.068861306
jan is fast approaching so wish very happy new year happy sankranti happy republic day happy valentines day happy shivratri happy ugadi happy fools day happy may day happy independence day happy friendshipmotherfatherteacherschildrens day amp happy birthday happy ganesh festival happy dasara happy diwali happy christmas ltgt good mornings afternoons evenings nights rememberi am the first to wishing all theseyours raj,ham,ham,0.35405213
thats very rude you on campus,ham,ham,0.002980096
hey still at the gym,ham,ham,0.003576443
don knowhe is watching film in computer,ham,ham,0.0073579885
happy new year my dear brother really do miss you just got your number and decided to send you this text wishing you only happiness abiola,ham,ham,0.3511501
hey am really want to chat text hot to text charged at pm to unsubscribe text stop,spam,ham,0.3991764
thinking of,ham,ham,0.022569774
hello my little party animal just thought id buzz you as you were with your friends grins reminding you were loved and send naughty adoring kiss,ham,smishing,0.62355316
yup thk cine is better cos no need go down plaza mah,ham,ham,0.077072255
aathiwhere are you deari am waiting for,ham,ham,0.007689649
todays vodafone numbers ending with are selected to receive award if your number matches call to receive your award,smishing,smishing,0.6798244
otherwise had part time job natuition,ham,ham,0.011424116
what happen to her tell the truth,ham,ham,0.008748432
dorothykiefercom bank of granite issues strongbuy explosive pick for our members up over nasdaq symbol cdgt that is per,spam,ham,0.36801198
im sorry ive joined the league of people that dont keep in touch you mean great deal to me you have been friend at all times even at great personal cost do have great week,ham,ham,0.4942287
cant wait to see you how were the photos were useful,ham,ham,0.062433448
daddy will take good care of you,ham,ham,0.006180917
new tones this week include mcflyall ab sara jorgeshock will smithswitch to order follow instructions on next message,spam,smishing,0.67572725
nah wednesday when should bring the mini cheetos bag over,ham,ham,0.42594644
its ok lar sleep early too nite,ham,ham,0.053588804
cant keep talking to people if am not sure can pay them if they agree to price so pls tell me what you want to really buy and how much you are willing to pay,ham,ham,0.47079408
ur mobile number won crores lakh rupees in chevrolet motors award for claim send name phone number address age toemailchevmotorlondonhotmailcom,smishing,smishing,0.9558225
ya knw vl givits ok thanks kanoanyway enjoy wit ur family wit st salary,ham,smishing,0.67067665
book which lesson then you msg me will call up after work or sth im going to get specs my membership is px,ham,ham,0.22889535
so that takes away some money worries,ham,ham,0.052793536
santa calling would your little ones like call from santa xmas eve call to book your time,spam,smishing,0.63846475
yeah imma come over cause jay wants to do some drugs,ham,ham,0.044968244
for your chance to win free bluetooth headset then simply reply back with adp,spam,ham,0.099181384
kkhow much does it cost,ham,ham,0.0024458077
are you coming to day for class,ham,ham,0.008672213
met you as stranger and choose you as my friend as long as the world stands our friendship never ends lets be friends forever gud nitz,ham,smishing,0.8172211
thank you princess want to see your nice juicy booty,ham,ham,0.046182808
doing nothing then not having dinner us,ham,ham,0.012610227
tiwary to rcbbattle between bang and kochi,ham,ham,0.0046271635
hiya stu wot up im in so much truble at home at moment evone hates me even wot the hell av done now wont just tell me text bck please luv dan,ham,smishing,0.73428506
check maili have mailed varma and kept copy to you regarding membershiptake careinsha allah,ham,smishing,0.86445606
got fujitsu ibm hp toshiba got lot of model how to say,ham,ham,0.09356187
sac needs to carry on,ham,ham,0.0015183932
she ran off with younger man we will make pretty babies together,ham,ham,0.18442865
your opinion about me over jada kusruthi lovable silent spl character not matured stylish simple,ham,smishing,0.52625036
but haf enuff space got like mb,ham,ham,0.013841078
where are the garage keys they arent on the bookshelf,ham,ham,0.013825883
detroit the home of snow enjoy it,ham,ham,0.0157046
huh hyde park not in mel ah opps got confused anyway if tts best choice den we juz have to take it,ham,smishing,0.5565391
sun cant come to earth but send luv as rays cloud cant come to river but send luv as rain cant come to meet but can send my care as msg to gud evng,ham,ham,0.46098354
does uncle timi help in clearing cars,ham,ham,0.0036877512
have secret admirer reveal who thinks so special call to opt out reply reveal stop per msg recd cust care,smishing,smishing,0.94083613
ok im gonna head up to usf in like fifteen minutes,ham,ham,0.019479696
no shit but wasnt that surprised so went and spent the evening with that french guy met in town here and we fooled around bit,ham,ham,0.34097263
cud tell ppl im gona bit cos buses hav gon past cos they were full im still waitin pete,ham,ham,0.45403862
come aftr ltdecimalgt now cleaning the house,ham,ham,0.025911968
aah cuddle would be lush id need lots of tea and soup before any kind of fumbling,ham,ham,0.21048579
bloomberg message center why wait apply for your future httpcareers bloombergcom,spam,ham,0.40272948
dont forget who owns you and whos private property you are and be my good boy always passionate kiss,ham,ham,0.29316667
she is our sister she belongs our family she is hope of tomorrow pray herwho was fated shoranur train incident lets hold our hands together amp fuelled by love amp concern prior her grief amp pain pls join in dis chain amp pass it stop violence against women,ham,smishing,0.5617951
cos was out shopping wif darren jus now called him ask wat present he wan lor then he started guessing who was wif he finally guessed darren lor,ham,smishing,0.97536194
will switch your fone on dammit,ham,ham,0.0116057005
er mw im filled tuth is aight,ham,ham,0.007399157
im gonna be home soon and dont want to talk about this stuff anymore tonight ive cried enough today,ham,smishing,0.87329
